domain,app,requirement,url
Web Browser,MetaProducts-Inquiry-Professional-Edition,A convenient toolbar button adds the page to one of the ten most-used folders.,https://www.softpedia.com/get/Internet/Browsers/MetaProducts-Inquiry-Professional-Edition.shtml
Web Browser,MetaProducts-Inquiry-Professional-Edition,You can also use drag-and-drop and the right-click context menu to store a page.,https://www.softpedia.com/get/Internet/Browsers/MetaProducts-Inquiry-Professional-Edition.shtml
Web Browser,MetaProducts-Inquiry-Professional-Edition,Drag a link to the Inquiry Band to download and save the page automatically.,https://www.softpedia.com/get/Internet/Browsers/MetaProducts-Inquiry-Professional-Edition.shtml
Web Browser,MetaProducts-Inquiry-Professional-Edition,Drag a selection with links to download and store all pages linked to the selection.,https://www.softpedia.com/get/Internet/Browsers/MetaProducts-Inquiry-Professional-Edition.shtml
Web Browser,MetaProducts-Inquiry-Professional-Edition,You can append the current page contents or a selection on the page to another page.,https://www.softpedia.com/get/Internet/Browsers/MetaProducts-Inquiry-Professional-Edition.shtml
Web Browser,MetaProducts-Inquiry-Professional-Edition,Use the Auto Save button to automatically store all pages you browse to a special folder.,https://www.softpedia.com/get/Internet/Browsers/MetaProducts-Inquiry-Professional-Edition.shtml
Web Browser,MetaProducts-Inquiry-Professional-Edition,Inquiry keeps all collected information in compressed files saving disk space.,https://www.softpedia.com/get/Internet/Browsers/MetaProducts-Inquiry-Professional-Edition.shtml
Web Browser,Wysigot-Light,Wysigot monitors your favorite sites!,https://www.softpedia.com/get/Internet/Browsers/Wysigot-Light.shtml
Web Browser,Wysigot-Light,Automatic or scheduled updates of documents.,https://www.softpedia.com/get/Internet/Browsers/Wysigot-Light.shtml
Web Browser,Wysigot-Light,Shows anything new by highlighting texts within the pages.,https://www.softpedia.com/get/Internet/Browsers/Wysigot-Light.shtml
Web Browser,Wysigot-Light,Online and offline browsing (clicked links are downloaded as soon as possible).,https://www.softpedia.com/get/Internet/Browsers/Wysigot-Light.shtml
Web Browser,Wysigot-Light,Alarms (for your most important documents).,https://www.softpedia.com/get/Internet/Browsers/Wysigot-Light.shtml
Web Browser,Wysigot-Light,"Allows you to fill in forms (search engines...) online and offline, and to submit them repeatedly if necessary.",https://www.softpedia.com/get/Internet/Browsers/Wysigot-Light.shtml
Web Browser,Wysigot-Light,Wysigot captures sites!,https://www.softpedia.com/get/Internet/Browsers/Wysigot-Light.shtml
Web Browser,Wysigot-Light,"Captures internet sites with scripts, styles, flash...",https://www.softpedia.com/get/Internet/Browsers/Wysigot-Light.shtml
Web Browser,Wysigot-Light,Unlimited number of pages without slowing down your PC.,https://www.softpedia.com/get/Internet/Browsers/Wysigot-Light.shtml
Web Browser,Wysigot-Light,Resumes interrupted downloadings (Web and Ftp).,https://www.softpedia.com/get/Internet/Browsers/Wysigot-Light.shtml
Web Browser,Wysigot-Light,Possibility of keeping former versions of documents.,https://www.softpedia.com/get/Internet/Browsers/Wysigot-Light.shtml
Web Browser,Wysigot-Light,"Black list, to eliminate advertising.",https://www.softpedia.com/get/Internet/Browsers/Wysigot-Light.shtml
Web Browser,Wysigot-Light,Displays downloads in progress and those still to be done.,https://www.softpedia.com/get/Internet/Browsers/Wysigot-Light.shtml
Web Browser,Wysigot-Light,Wysigot makes it easier!,https://www.softpedia.com/get/Internet/Browsers/Wysigot-Light.shtml
Web Browser,Wysigot-Light,Advanced search.,https://www.softpedia.com/get/Internet/Browsers/Wysigot-Light.shtml
Web Browser,Wysigot-Light,Automatic or manual organization of documents.,https://www.softpedia.com/get/Internet/Browsers/Wysigot-Light.shtml
Web Browser,Wysigot-Light,"Advanced management (cookies, scripts, activeX, flash, css...).",https://www.softpedia.com/get/Internet/Browsers/Wysigot-Light.shtml
Web Browser,Wysigot-Light,Individual or grouped properties edition of documents.,https://www.softpedia.com/get/Internet/Browsers/Wysigot-Light.shtml
Web Browser,Wysigot-Light,Detailed display of the pages' parameters and information.,https://www.softpedia.com/get/Internet/Browsers/Wysigot-Light.shtml
Web Browser,Wysigot-Light,Annotations document by document.,https://www.softpedia.com/get/Internet/Browsers/Wysigot-Light.shtml
Web Browser,Wysigot-Light,Instant search of any URL or document name in the address bar.,https://www.softpedia.com/get/Internet/Browsers/Wysigot-Light.shtml
Web Browser,Wysigot-Light,Recycle bin (to recover accidentally deleted documents).,https://www.softpedia.com/get/Internet/Browsers/Wysigot-Light.shtml
Web Browser,Wysigot-Light,Imports Favorites (Internet Explorer).,https://www.softpedia.com/get/Internet/Browsers/Wysigot-Light.shtml
Web Browser,Wysigot-Light,Wysigot updates itself automatically (after confirmation).,https://www.softpedia.com/get/Internet/Browsers/Wysigot-Light.shtml
Web Browser,YRC-Weblink,WebGL Enabled Graphics,https://www.softpedia.com/get/Internet/Browsers/YRC-Weblink.shtml
Web Browser,YRC-Weblink,OSPFC Security Tabs,https://www.softpedia.com/get/Internet/Browsers/YRC-Weblink.shtml
Web Browser,YRC-Weblink,YRC Backup Manager,https://www.softpedia.com/get/Internet/Browsers/YRC-Weblink.shtml
Web Browser,Cubicle-Web-Browser,"HTML5, CSS3, JS, HTML5 Video, WebGL 3D, etc",https://www.softpedia.com/get/Internet/Browsers/Cubicle-Web-Browser.shtml
Web Browser,Cubicle-Web-Browser,Flash (only with PPAI systemwwide installation of Flash),https://www.softpedia.com/get/Internet/Browsers/Cubicle-Web-Browser.shtml
Web Browser,Cubicle-Web-Browser,Tabbed browsing,https://www.softpedia.com/get/Internet/Browsers/Cubicle-Web-Browser.shtml
Web Browser,Cubicle-Web-Browser,Address bar (also opens Google),https://www.softpedia.com/get/Internet/Browsers/Cubicle-Web-Browser.shtml
Web Browser,Cubicle-Web-Browser,"Back, Forward, Stop, Refresh",https://www.softpedia.com/get/Internet/Browsers/Cubicle-Web-Browser.shtml
Web Browser,Cubicle-Web-Browser,Developer tools,https://www.softpedia.com/get/Internet/Browsers/Cubicle-Web-Browser.shtml
Web Browser,Cubicle-Web-Browser,Parental Controls (with password protection for settings and erasing history),https://www.softpedia.com/get/Internet/Browsers/Cubicle-Web-Browser.shtml
Web Browser,Cubicle-Web-Browser,Sticky notes,https://www.softpedia.com/get/Internet/Browsers/Cubicle-Web-Browser.shtml
Web Browser,Cubicle-Web-Browser,Search bar (also highlights all instances),https://www.softpedia.com/get/Internet/Browsers/Cubicle-Web-Browser.shtml
Web Browser,Cubicle-Web-Browser,Download manager,https://www.softpedia.com/get/Internet/Browsers/Cubicle-Web-Browser.shtml
Web Browser,Cubicle-Web-Browser,Download Location Dialog (Asks where to download file),https://www.softpedia.com/get/Internet/Browsers/Cubicle-Web-Browser.shtml
Web Browser,Cubicle-Web-Browser,Popups,https://www.softpedia.com/get/Internet/Browsers/Cubicle-Web-Browser.shtml
Web Browser,Cubicle-Web-Browser,Browsing History,https://www.softpedia.com/get/Internet/Browsers/Cubicle-Web-Browser.shtml
Web Browser,Cubicle-Web-Browser,"Quick launcher (For important, useful sites)",https://www.softpedia.com/get/Internet/Browsers/Cubicle-Web-Browser.shtml
Web Browser,Cubicle-Web-Browser,Custom error pages,https://www.softpedia.com/get/Internet/Browsers/Cubicle-Web-Browser.shtml
Web Browser,Cubicle-Web-Browser,Drop Down Menu.,https://www.softpedia.com/get/Internet/Browsers/Cubicle-Web-Browser.shtml
Web Browser,Cubicle-Web-Browser,"Settings which allow customization of homepage, default search engine and has the",https://www.softpedia.com/get/Internet/Browsers/Cubicle-Web-Browser.shtml
Web Browser,Cubicle-Web-Browser,option to not show splash screen at startup.,https://www.softpedia.com/get/Internet/Browsers/Cubicle-Web-Browser.shtml
Web Browser,Cubicle-Web-Browser,Multiple tabs and Multiple windows,https://www.softpedia.com/get/Internet/Browsers/Cubicle-Web-Browser.shtml
Web Browser,Cubicle-Web-Browser,View online & offline webpages,https://www.softpedia.com/get/Internet/Browsers/Cubicle-Web-Browser.shtml
Web Browser,Cubicle-Web-Browser,PDF files supported,https://www.softpedia.com/get/Internet/Browsers/Cubicle-Web-Browser.shtml
Web Browser,Cubicle-Web-Browser,Menu at the bottom left part of the page.,https://www.softpedia.com/get/Internet/Browsers/Cubicle-Web-Browser.shtml
Web Browser,Kylo,Lots of viewing space and no visual clutter,https://www.softpedia.com/get/Internet/Browsers/Kylo.shtml
Web Browser,Kylo,Big fonts and big buttons for easy navigation from across the room,https://www.softpedia.com/get/Internet/Browsers/Kylo.shtml
Web Browser,Kylo,An easy-to-use onscreen keyboard,https://www.softpedia.com/get/Internet/Browsers/Kylo.shtml
Web Browser,Kylo,Zoom-and-pan power that brings every site into view,https://www.softpedia.com/get/Internet/Browsers/Kylo.shtml
Web Browser,Kylo,"Sit back and get ready for big-screen browsing. Kylo brings your TV and computer together to create the ultimate content experience. Enjoy your favorite online shows, videos, music, games and news. Take your HDTV anywhere on the web.",https://www.softpedia.com/get/Internet/Browsers/Kylo.shtml
Web Browser,Kylo,Find the web content you want. Click and watch without getting off the couch.,https://www.softpedia.com/get/Internet/Browsers/Kylo.shtml
Web Browser,Kylo,Kylo's wide-open interface is designed specifically to fit your TV screen. It's not just a blown-up web browser. Kylo lets you enjoy your favorite content fast. Don't waste time hunting through lists of links and unreadable text. See what you want to see!,https://www.softpedia.com/get/Internet/Browsers/Kylo.shtml
Web Browser,Kylo,"The last thing you need is another piece of equipment cluttering your coffee table. Use Kylo's onscreen keyboard instead! Quick and intuitive, it lets you input web addresses, instant messages, and even emails using a classic QWERTY interface.",https://www.softpedia.com/get/Internet/Browsers/Kylo.shtml
Web Browser,Kylo,"Onscreen reading is a breeze with Kylo. The Zoom-and-Pan feature lets you enjoy text content when you're ten feet from the screen. Instead of squinting, sit back and enjoy online content the right way.",https://www.softpedia.com/get/Internet/Browsers/Kylo.shtml
Web Browser,MetaProducts-Inquiry-Standard-Edition,"You can store all kinds of web pages, images and Shockwave Flash files.",https://www.softpedia.com/get/Internet/Browsers/MetaProducts-Inquiry-Standard-Edition.shtml
Web Browser,MetaProducts-Inquiry-Standard-Edition,The Saved Pages folder allows you to save a page with just one click.,https://www.softpedia.com/get/Internet/Browsers/MetaProducts-Inquiry-Standard-Edition.shtml
Web Browser,MetaProducts-Inquiry-Standard-Edition,A convenient toolbar button adds the page to one of the ten most-used folders.,https://www.softpedia.com/get/Internet/Browsers/MetaProducts-Inquiry-Standard-Edition.shtml
Web Browser,MetaProducts-Inquiry-Standard-Edition,You can also use drag-and-drop and the right-click context menu to store a page.,https://www.softpedia.com/get/Internet/Browsers/MetaProducts-Inquiry-Standard-Edition.shtml
Web Browser,MetaProducts-Inquiry-Standard-Edition,Drag a link to the Inquiry Band to download and save the page automatically.,https://www.softpedia.com/get/Internet/Browsers/MetaProducts-Inquiry-Standard-Edition.shtml
Web Browser,MetaProducts-Inquiry-Standard-Edition,Drag a selection with links to download and store all pages linked to the selection.,https://www.softpedia.com/get/Internet/Browsers/MetaProducts-Inquiry-Standard-Edition.shtml
Web Browser,MetaProducts-Inquiry-Standard-Edition,You can append the current page contents or a selection on the page to another page.,https://www.softpedia.com/get/Internet/Browsers/MetaProducts-Inquiry-Standard-Edition.shtml
Web Browser,MetaProducts-Inquiry-Standard-Edition,Use the Auto Save button to automatically store all pages you browse to a special folder.,https://www.softpedia.com/get/Internet/Browsers/MetaProducts-Inquiry-Standard-Edition.shtml
Web Browser,MetaProducts-Inquiry-Standard-Edition,Inquiry keeps all collected information in compressed files saving disk space.,https://www.softpedia.com/get/Internet/Browsers/MetaProducts-Inquiry-Standard-Edition.shtml
Web Browser,WAP-Proof-2007-Pro,XML syntax validation,https://www.softpedia.com/get/Internet/Browsers/WAP-Proof-2007-Pro.shtml
Web Browser,WAP-Proof-2007-Pro,Viewing XML entities as characters,https://www.softpedia.com/get/Internet/Browsers/WAP-Proof-2007-Pro.shtml
Web Browser,WAP-Proof-2007-Pro,Logging of the HTTP traffic,https://www.softpedia.com/get/Internet/Browsers/WAP-Proof-2007-Pro.shtml
Web Browser,WAP-Proof-2007-Pro,User can modify HTTP headers and query directly,https://www.softpedia.com/get/Internet/Browsers/WAP-Proof-2007-Pro.shtml
Web Browser,WAP-Proof-2007-Pro,User can modify POST requests,https://www.softpedia.com/get/Internet/Browsers/WAP-Proof-2007-Pro.shtml
Web Browser,WAP-Proof-2007-Pro,Working offline,https://www.softpedia.com/get/Internet/Browsers/WAP-Proof-2007-Pro.shtml
Web Browser,WAP-Proof-2007-Pro,Viewing WML context variables,https://www.softpedia.com/get/Internet/Browsers/WAP-Proof-2007-Pro.shtml
Web Browser,WAP-Proof-2007-Pro,Highlighting of the XML syntax,https://www.softpedia.com/get/Internet/Browsers/WAP-Proof-2007-Pro.shtml
Web Browser,WAP-Proof-2007-Pro,Tolerance to XML syntax errors,https://www.softpedia.com/get/Internet/Browsers/WAP-Proof-2007-Pro.shtml
Web Browser,WAP-Proof-2007-Pro,Control over WML events,https://www.softpedia.com/get/Internet/Browsers/WAP-Proof-2007-Pro.shtml
Web Browser,WAP-Proof-2007-Pro,Support of basic HTTP authentication,https://www.softpedia.com/get/Internet/Browsers/WAP-Proof-2007-Pro.shtml
Web Browser,WAP-Proof-2007-Pro,Work with HTTPS protocol,https://www.softpedia.com/get/Internet/Browsers/WAP-Proof-2007-Pro.shtml
Web Browser,Runecats-Explorer,Tabbed Browsing,https://www.softpedia.com/get/Internet/Browsers/Runecats-Explorer.shtml
Web Browser,Runecats-Explorer,"Text size changer - Runecats Explorer has a text size changer, so you are able to see the text enlarged",https://www.softpedia.com/get/Internet/Browsers/Runecats-Explorer.shtml
Web Browser,Runecats-Explorer,MiniWeb- Runecats famouse MiniWeb has been improved again!,https://www.softpedia.com/get/Internet/Browsers/Runecats-Explorer.shtml
Web Browser,Runecats-Explorer,"Search Drawer- Runecats have noticed all main browsers have a search bar on them, so we decided to add this with a twist, we have a pop-out drawer like search bar, it makes searching slightly quicker and saves lots of room.",https://www.softpedia.com/get/Internet/Browsers/Runecats-Explorer.shtml
Web Browser,Runecats-Explorer,"Runetext extention, improved finding tool, faster engine, skins, center button and many many more",https://www.softpedia.com/get/Internet/Browsers/Runecats-Explorer.shtml
Web Browser,Visual-Explorer,Print web pages exactly how they look on screen,https://www.softpedia.com/get/Internet/Browsers/Visual-Explorer.shtml
Web Browser,Visual-Explorer,Perform instant Google searches with a single click,https://www.softpedia.com/get/Internet/Browsers/Visual-Explorer.shtml
Web Browser,Visual-Explorer,"Easily manage your favorites, RSS feeds and more",https://www.softpedia.com/get/Internet/Browsers/Visual-Explorer.shtml
Web Browser,Visual-Explorer,Browse secure web pages with total privacy,https://www.softpedia.com/get/Internet/Browsers/Visual-Explorer.shtml
Web Browser,Visual-Explorer,Help avoid phishing websites with advanced protection,https://www.softpedia.com/get/Internet/Browsers/Visual-Explorer.shtml
Web Browser,Visual-Explorer,"Automatically block adverts, animations and sounds",https://www.softpedia.com/get/Internet/Browsers/Visual-Explorer.shtml
Web Browser,Visual-Explorer,Effectively track and manage your file downloads,https://www.softpedia.com/get/Internet/Browsers/Visual-Explorer.shtml
Web Browser,Visual-Explorer,Work with your favorite Internet Explorer add-ons,https://www.softpedia.com/get/Internet/Browsers/Visual-Explorer.shtml
Web Browser,Visual-Explorer,Customize the browser interface with themes and skins,https://www.softpedia.com/get/Internet/Browsers/Visual-Explorer.shtml
Web Browser,GT-Web-Browser,Easy and fast navigation,https://www.softpedia.com/get/Internet/Browsers/GT-Web-Browser.shtml
Web Browser,GT-Web-Browser,Easy to use interface,https://www.softpedia.com/get/Internet/Browsers/GT-Web-Browser.shtml
Web Browser,GT-Web-Browser,Aero theme,https://www.softpedia.com/get/Internet/Browsers/GT-Web-Browser.shtml
Web Browser,GT-Web-Browser,MDI Tab Control,https://www.softpedia.com/get/Internet/Browsers/GT-Web-Browser.shtml
Web Browser,GT-Web-Browser,Use of the Pipelining method and some other tricks to gain more speed,https://www.softpedia.com/get/Internet/Browsers/GT-Web-Browser.shtml
Web Browser,GT-Web-Browser,Use of Privoxy (Download by visiting Addons),https://www.softpedia.com/get/Internet/Browsers/GT-Web-Browser.shtml
Web Browser,GT-Web-Browser,Better interface and menu,https://www.softpedia.com/get/Internet/Browsers/GT-Web-Browser.shtml
Web Browser,GT-Web-Browser,Built-In Adblock and Anti-Phishing (Provided you have installed Privoxy for GT Web Browser 3),https://www.softpedia.com/get/Internet/Browsers/GT-Web-Browser.shtml
Web Browser,GT-Web-Browser,Better Bookmarks and History management,https://www.softpedia.com/get/Internet/Browsers/GT-Web-Browser.shtml
Web Browser,GT-Web-Browser,CSS Importer,https://www.softpedia.com/get/Internet/Browsers/GT-Web-Browser.shtml
Web Browser,GT-Web-Browser,Better Find Function,https://www.softpedia.com/get/Internet/Browsers/GT-Web-Browser.shtml
Web Browser,GT-Web-Browser,Full Page Zoom and Text Zoom support,https://www.softpedia.com/get/Internet/Browsers/GT-Web-Browser.shtml
Web Browser,GT-Web-Browser,Support for Downloads and HTML5 without the need of Compatibility Mode,https://www.softpedia.com/get/Internet/Browsers/GT-Web-Browser.shtml
Web Browser,GT-Web-Browser,More Security Features,https://www.softpedia.com/get/Internet/Browsers/GT-Web-Browser.shtml
Web Browser,GT-Web-Browser,Support for HTML5 pages,https://www.softpedia.com/get/Internet/Browsers/GT-Web-Browser.shtml
Web Browser,GT-Web-Browser,"Support for the latest versions of Java, Adobe Flash Player and Adobe Shockwave Player",https://www.softpedia.com/get/Internet/Browsers/GT-Web-Browser.shtml
Web Browser,SphereXPlorer,display LIVE explorer windows in a 3D environment,https://www.softpedia.com/get/Internet/Browsers/SphereXPlorer.shtml
Web Browser,SphereXPlorer,provide easy manipulations and navigation,https://www.softpedia.com/get/Internet/Browsers/SphereXPlorer.shtml
Web Browser,SphereXPlorer,makes browsing easier,https://www.softpedia.com/get/Internet/Browsers/SphereXPlorer.shtml
Web Browser,HyperNet-Browser,Export discovered email addresses to a file,https://www.softpedia.com/get/Internet/Browsers/HyperNet-Browser.shtml
Web Browser,HyperNet-Browser,Matrix Scan View - Purely for atmosphere,https://www.softpedia.com/get/Internet/Browsers/HyperNet-Browser.shtml
Web Browser,HyperNet-Browser,Save and load databases for future reference or use.,https://www.softpedia.com/get/Internet/Browsers/HyperNet-Browser.shtml
Web Browser,HyperNet-Browser,View source code for web pages,https://www.softpedia.com/get/Internet/Browsers/HyperNet-Browser.shtml
Web Browser,HyperNet-Browser,Scan the net for web pages,https://www.softpedia.com/get/Internet/Browsers/HyperNet-Browser.shtml
Web Browser,HyperNet-Browser,Import your old database from HyperNet v1,https://www.softpedia.com/get/Internet/Browsers/HyperNet-Browser.shtml
Web Browser,HyperNet-Browser,Alter your scanning preferences to expand your crawl in different patterns,https://www.softpedia.com/get/Internet/Browsers/HyperNet-Browser.shtml
Web Browser,HyperNet-Browser,Optimize your database for faster searches,https://www.softpedia.com/get/Internet/Browsers/HyperNet-Browser.shtml
Web Browser,HyperNet-Browser,Adjust search settings,https://www.softpedia.com/get/Internet/Browsers/HyperNet-Browser.shtml
Web Browser,HyperNet-Browser,Include & Exclude pages from search results,https://www.softpedia.com/get/Internet/Browsers/HyperNet-Browser.shtml
Web Browser,HyperNet-Browser,Search your database for information and get detailed results from scanned web pages,https://www.softpedia.com/get/Internet/Browsers/HyperNet-Browser.shtml
Web Browser,Maxthon-3,Online Favorites Service: Access your Favorites content anywhere with Maxthon Online Favorites Service. The encrypted stand-alone Favorites file format can protect your privacy on a shared computer.,https://www.softpedia.com/get/Internet/Browsers/Maxthon-3.shtml
Web Browser,Maxthon-3,Tabbed Browsing: All the web pages are arranged as tabs inside main window to ease your navigation.,https://www.softpedia.com/get/Internet/Browsers/Maxthon-3.shtml
Web Browser,Maxthon-3,"Mouse GesturesHold right mouse button and perform the gestures to access common features such as Back, Forward, Refresh and Close Tab.",https://www.softpedia.com/get/Internet/Browsers/Maxthon-3.shtml
Web Browser,Maxthon-3,Super Drag&Drop: Type the keywords in Address Bar then press Enter to perform a search. Or simply drag & drop a keyword with your mouse.,https://www.softpedia.com/get/Internet/Browsers/Maxthon-3.shtml
Web Browser,Maxthon-3,Ad Hunter: Ad Hunter can efficiently clean up the web pages by stopping Popup Windows and removing Ad Content Blocks.,https://www.softpedia.com/get/Internet/Browsers/Maxthon-3.shtml
Web Browser,Maxthon-3,Fully Customizable: Plugins. Skins. Filter Packs. Multi-language,https://www.softpedia.com/get/Internet/Browsers/Maxthon-3.shtml
Web Browser,UR-Browser,"With our headquarters in the EU, we are forced to respect user privacy to a much higher level in comparison to other countries, namely the United States.",https://www.softpedia.com/get/Internet/Browsers/UR-Browser.shtml
Web Browser,UR-Browser,"Any setting that could compromise your privacy is deactivated by default. Examples include third-party cookies, password autofill, prediction text and more.",https://www.softpedia.com/get/Internet/Browsers/UR-Browser.shtml
Web Browser,UR-Browser,A built-in VPN helps you stay anonymous and safe by creating an encrypted tunnel between your computer and websites.,https://www.softpedia.com/get/Internet/Browsers/UR-Browser.shtml
Web Browser,UR-Browser,Every file you download is automatically scanned for viruses and checked against a database updated in real time. Files that are suspicious are clearly marked in red for you to review.,https://www.softpedia.com/get/Internet/Browsers/UR-Browser.shtml
Web Browser,UR-Browser,Websites are rated by a large community of internet users so you know a site's reputation immediately simply by looking the Shield in the upper corner of UR.,https://www.softpedia.com/get/Internet/Browsers/UR-Browser.shtml
Web Browser,UR-Browser,"Homescreen: Your own personalized Homescreen centralizes news, weather, search and more.",https://www.softpedia.com/get/Internet/Browsers/UR-Browser.shtml
Web Browser,UR-Browser,"Customization: With an extensive gallery of 2D and 3D wallpapers, you can customize the theme of your browser as well as the background of your Homescreen.",https://www.softpedia.com/get/Internet/Browsers/UR-Browser.shtml
Web Browser,UR-Browser,"Moods: Get quick access to your favorite sites (sorted into profiles called Moods), straight from the Homescreen.",https://www.softpedia.com/get/Internet/Browsers/UR-Browser.shtml
Web Browser,UR-Browser,"Download Booster: Files download 3x faster than traditional browsers thanks to an advanced, multi-threading technology.",https://www.softpedia.com/get/Internet/Browsers/UR-Browser.shtml
Web Browser,WebFreer,Access any website through secured https connections,https://www.softpedia.com/get/Internet/Browsers/WebFreer.shtml
Web Browser,WebFreer,Encrypted TCP connections to all websites,https://www.softpedia.com/get/Internet/Browsers/WebFreer.shtml
Web Browser,WebFreer,"Fast browsing of all websites, in lightening speed",https://www.softpedia.com/get/Internet/Browsers/WebFreer.shtml
Web Browser,WebFreer,Protect internet users from online identity theft,https://www.softpedia.com/get/Internet/Browsers/WebFreer.shtml
Web Browser,WebFreer,Secure your data exchange with any information site or online stores.,https://www.softpedia.com/get/Internet/Browsers/WebFreer.shtml
Web Browser,WebFreer,Encrypt web browser data,https://www.softpedia.com/get/Internet/Browsers/WebFreer.shtml
Web Browser,WebFreer,Obfuscate Socks5 protocol,https://www.softpedia.com/get/Internet/Browsers/WebFreer.shtml
Web Browser,WebFreer,Protect privacy,https://www.softpedia.com/get/Internet/Browsers/WebFreer.shtml
Web Browser,WebFreer,Access blocked website,https://www.softpedia.com/get/Internet/Browsers/WebFreer.shtml
Web Browser,WebFreer,Use open source Chromium browser,https://www.softpedia.com/get/Internet/Browsers/WebFreer.shtml
Web Browser,WebFreer,Secure your online surfing with Web Freer,https://www.softpedia.com/get/Internet/Browsers/WebFreer.shtml
Web Browser,Xvast,Fastest: Chrome's latest core(version 54) speed,https://www.softpedia.com/get/Internet/Browsers/Xvast.shtml
Web Browser,Xvast,Powerful: Xvast browser support all the latest HTML5 features,https://www.softpedia.com/get/Internet/Browsers/Xvast.shtml
Web Browser,Xvast,Xvast supports DRM-X 4.0 protection. It enables you easily enjoy the protected premium content,https://www.softpedia.com/get/Internet/Browsers/Xvast.shtml
Web Browser,MySurf,Customize the color of the browser.,https://www.softpedia.com/get/Internet/Browsers/MySurf.shtml
Web Browser,MySurf,Set a password that you need to enter to use the application.,https://www.softpedia.com/get/Internet/Browsers/MySurf.shtml
