domain,app,requirement,url
Web Browser,Maxthon-Standard,"Maxthon Browser has full IE compatibility which means you will still have all you have in IE. Maxthon Browser uses very few resources, resulting in an average of 65% less RAM usage compares to IE when having the same large number of pages open.",https://www.softpedia.com/get/Internet/Browsers/Maxthon-Standard.shtml
Web Browser,Slimjet,Smarter and more convenient than the basic password manager in Chrome. Save page link and login data in a form file which let you open your favorite online account with a single click later on.,https://www.softpedia.com/get/Internet/Browsers/Slimjet.shtml
Web Browser,Slimjet,Slimjet let users customize the toolbar and add/remove additional buttons to quickly access additional features and functionality.,https://www.softpedia.com/get/Internet/Browsers/Slimjet.shtml
Web Browser,Slimjet,"In Slimjet, you can share the link you visited, a paragraph of text or an image easily on Facebook with a single click on the facebook toolbar button.",https://www.softpedia.com/get/Internet/Browsers/Slimjet.shtml
Web Browser,Slimjet,"Download any YouTube video to local hard disk in specified resolution and file format (mp4, agp, flv). You can also convert the downloaded video file into mp3 file automatically.",https://www.softpedia.com/get/Internet/Browsers/Slimjet.shtml
Web Browser,Slimjet,Slimjet includes a Photo Salon in which you cano apply different effects or add beautiful frames to the photos before they are uploaded.,https://www.softpedia.com/get/Internet/Browsers/Slimjet.shtml
Web Browser,Slimjet,Automatically compress photos to web-optimized resolution so that photos are uploaded up to 20 times faster.,https://www.softpedia.com/get/Internet/Browsers/Slimjet.shtml
Web Browser,Slimjet,Display current weather condition and weather forecast directly on the browser window.,https://www.softpedia.com/get/Internet/Browsers/Slimjet.shtml
Web Browser,Slimjet,"Slimjet lets you define short aliases for long URLs which are slow to type and hard to remember. After that, just type the aliases from the omnibox to open the corresponding page.",https://www.softpedia.com/get/Internet/Browsers/Slimjet.shtml
Web Browser,Slimjet,"Instead of automatically translating a full web page into the current UI language, Slimjet lets you translate a web page or a piece of text between any two specified languages.",https://www.softpedia.com/get/Internet/Browsers/Slimjet.shtml
Web Browser,Slimjet,Slimjet provides many additional options and settings so that you can customize the browser to best suit your personal preference instead of being forced to take everything as it is without any choice.,https://www.softpedia.com/get/Internet/Browsers/Slimjet.shtml
Web Browser,Cent-Browser,Lots of Tab Options,https://www.softpedia.com/get/Internet/Browsers/Cent-Browser.shtml
Web Browser,Cent-Browser,Scrollbale Tab Bar,https://www.softpedia.com/get/Internet/Browsers/Cent-Browser.shtml
Web Browser,Cent-Browser,Incognito Tab,https://www.softpedia.com/get/Internet/Browsers/Cent-Browser.shtml
Web Browser,Cent-Browser,Single Renderer Process,https://www.softpedia.com/get/Internet/Browsers/Cent-Browser.shtml
Web Browser,Cent-Browser,Mouse Gesture,https://www.softpedia.com/get/Internet/Browsers/Cent-Browser.shtml
Web Browser,Deepnet-Explorer,Multi start page: load multiple start pages when you launch your browser;,https://www.softpedia.com/get/Internet/Browsers/Deepnet-Explorer.shtml
Web Browser,Deepnet-Explorer,Built-in Pop Blocker: eliminate annoying pop advertising when you visit websites;,https://www.softpedia.com/get/Internet/Browsers/Deepnet-Explorer.shtml
Web Browser,Deepnet-Explorer,"Mouse Gestures: use your mouse to move forward/back between pages, refresh your screen, and move to different tabs;",https://www.softpedia.com/get/Internet/Browsers/Deepnet-Explorer.shtml
Web Browser,Deepnet-Explorer,built-in Search Engine: type a search term into your browser address bar and click search to view relevant search results;,https://www.softpedia.com/get/Internet/Browsers/Deepnet-Explorer.shtml
Web Browser,Deepnet-Explorer,Auto Login: store and retrieve website login details automatically;,https://www.softpedia.com/get/Internet/Browsers/Deepnet-Explorer.shtml
Web Browser,Deepnet-Explorer,"Auto Form Fill: automatically fill online forms without typing your details, to save the hassle of repeatedly filling in your details;",https://www.softpedia.com/get/Internet/Browsers/Deepnet-Explorer.shtml
Web Browser,Deepnet-Explorer,RSS/Atom News Reader: Subscribe to your favorite news feeds and let the news reader compile and display the latest news on one screen.,https://www.softpedia.com/get/Internet/Browsers/Deepnet-Explorer.shtml
Web Browser,WinWAP-for-Windows,Tabbed Mobile Internet browsing,https://www.softpedia.com/get/Internet/Browsers/WinWAP-for-Windows.shtml
Web Browser,WinWAP-for-Windows,WAP 2.0 (xHTML Mobile Profile + WML) browsing,https://www.softpedia.com/get/Internet/Browsers/WinWAP-for-Windows.shtml
Web Browser,WinWAP-for-Windows,WinWAP Mobile Transcoding allows HTML 4.0 pages to be opened (reduced HTML support),https://www.softpedia.com/get/Internet/Browsers/WinWAP-for-Windows.shtml
Web Browser,32bit-Web-Browser,Four default options for handling New Web Browser Windows,https://www.softpedia.com/get/Internet/Browsers/32bit-Web-Browser.shtml
Web Browser,32bit-Web-Browser,Four selected group lists options for handling New Web Browser Windows,https://www.softpedia.com/get/Internet/Browsers/32bit-Web-Browser.shtml
Web Browser,32bit-Web-Browser,Import bookmark.htm from Netscape and Favorites from Internet Explorer,https://www.softpedia.com/get/Internet/Browsers/32bit-Web-Browser.shtml
Web Browser,32bit-Web-Browser,History of the last 1000 sites visited,https://www.softpedia.com/get/Internet/Browsers/32bit-Web-Browser.shtml
Web Browser,32bit-Web-Browser,5 options for docking bookmarks window,https://www.softpedia.com/get/Internet/Browsers/32bit-Web-Browser.shtml
Web Browser,32bit-Web-Browser,Easily organize bookmarks,https://www.softpedia.com/get/Internet/Browsers/32bit-Web-Browser.shtml
Web Browser,Portable-ChromePlus,"When the browser closed, the selected browsing data would be cleared automatically(not selected by default). You can go to OptionsPrivacy DataPrivacy Plus to setup.",https://www.softpedia.com/get/Internet/Browsers/Portable-ChromePlus.shtml
Web Browser,Portable-ChromePlus,You can make efficient commands with easy mouse gestures. Practiced mouse gestures can save you quite a lot of time and are fun.,https://www.softpedia.com/get/Internet/Browsers/Portable-ChromePlus.shtml
Web Browser,Portable-ChromePlus,Some web pages use IE controls and thus can only run in IE correctly. The IE tab is designed to visit these pages.,https://www.softpedia.com/get/Internet/Browsers/Portable-ChromePlus.shtml
Web Browser,Portable-ChromePlus,"With the bulid-in Adblock, CoolNovo can prevent the display of ads. Especially, the Adblock of CoolNovo supports the rules of the world famous Adblock Plus' rule and thus make use of the existing blocking-list of Adblock Plus.",https://www.softpedia.com/get/Internet/Browsers/Portable-ChromePlus.shtml
Web Browser,Portable-ChromePlus,Dragging and dropping a block of text in the page will create a page and search the text with your default search engine. You can also drag the links and pictures to open them in the newtab page.,https://www.softpedia.com/get/Internet/Browsers/Portable-ChromePlus.shtml
Web Browser,Portable-ChromePlus,"For your convenience, CoolNovo supports some popular download tools in the context menu of web pages. Therere more than 10 kinds of downloading tool supported including NetAnts, Orbit, QQ Xuanfeng, IS, FlashGet3, FlashGetMini, NetX, WebThunder, Xunlei, and so on.",https://www.softpedia.com/get/Internet/Browsers/Portable-ChromePlus.shtml
Web Browser,Portable-ChromePlus,"A new feature of CoolNovo, there're some common-used features on the Bottom toolbar, very convenient and useful.",https://www.softpedia.com/get/Internet/Browsers/Portable-ChromePlus.shtml
Web Browser,Polarity,Powered by the Chromium and Trident engines.,https://www.softpedia.com/get/Internet/Browsers/Polarity.shtml
Web Browser,Polarity,Ability to save tabs.,https://www.softpedia.com/get/Internet/Browsers/Polarity.shtml
Web Browser,Polarity,Powerful Garbage collector.,https://www.softpedia.com/get/Internet/Browsers/Polarity.shtml
Web Browser,Polarity,Autocomplete omnibar.,https://www.softpedia.com/get/Internet/Browsers/Polarity.shtml
Web Browser,Polarity,Ad Blocker.,https://www.softpedia.com/get/Internet/Browsers/Polarity.shtml
Web Browser,Polarity,"HTML5, CSS3, WebGL, Hardware Accel., etc. support",https://www.softpedia.com/get/Internet/Browsers/Polarity.shtml
Web Browser,Polarity,"HTML5 Test: 512/555, Acid3 Test: 100/100.",https://www.softpedia.com/get/Internet/Browsers/Polarity.shtml
Web Browser,Polarity,"Apps, Extensions (Userscripts), and Addons",https://www.softpedia.com/get/Internet/Browsers/Polarity.shtml
Web Browser,Polarity,Password Manager,https://www.softpedia.com/get/Internet/Browsers/Polarity.shtml
Web Browser,SecretBrowser,Different and intuitive interface,https://www.softpedia.com/get/Internet/Browsers/SecretBrowser.shtml
Web Browser,SecretBrowser,Aero style support,https://www.softpedia.com/get/Internet/Browsers/SecretBrowser.shtml
Web Browser,SecretBrowser,Taskbar progress,https://www.softpedia.com/get/Internet/Browsers/SecretBrowser.shtml
Web Browser,SecretBrowser,Quick-Hide,https://www.softpedia.com/get/Internet/Browsers/SecretBrowser.shtml
Web Browser,SecretBrowser,Support tor touch gestures,https://www.softpedia.com/get/Internet/Browsers/SecretBrowser.shtml
Web Browser,SecretBrowser,Touch friendly interface,https://www.softpedia.com/get/Internet/Browsers/SecretBrowser.shtml
Web Browser,GINternet-Explorer,"Has its own music player, so you can play, pause and even stop the song!",https://www.softpedia.com/get/Internet/Browsers/GINternet-Explorer.shtml
Web Browser,GINternet-Explorer,"Create your own playlist, and view all your music in its own library!",https://www.softpedia.com/get/Internet/Browsers/GINternet-Explorer.shtml
Web Browser,GINternet-Explorer,"Easy access to favorites, help, and other support!",https://www.softpedia.com/get/Internet/Browsers/GINternet-Explorer.shtml
Web Browser,GINternet-Explorer,AutoComplete,https://www.softpedia.com/get/Internet/Browsers/GINternet-Explorer.shtml
Web Browser,GINternet-Explorer,Integrated programs like Paint or AIM,https://www.softpedia.com/get/Internet/Browsers/GINternet-Explorer.shtml
Web Browser,GINternet-Explorer,"Has its own list of hyperlinks, click on them will take you instantly to the link!",https://www.softpedia.com/get/Internet/Browsers/GINternet-Explorer.shtml
Web Browser,GINternet-Explorer,Popup Blocker.,https://www.softpedia.com/get/Internet/Browsers/GINternet-Explorer.shtml
Web Browser,JiveQ,InfoClick,https://www.softpedia.com/get/Internet/Browsers/JiveQ.shtml
Web Browser,JiveQ,"Get instant information, answers and search results for the clicked on word whether you're in a browser, email or other application such as Office or Acrobat.",https://www.softpedia.com/get/Internet/Browsers/JiveQ.shtml
Web Browser,JiveQ,Answer Browser,https://www.softpedia.com/get/Internet/Browsers/JiveQ.shtml
Web Browser,JiveQ,"JiveQ comes with a fully functional drag and drop browser that has all the standard browser features such as inline search, tabs, popup blocker and custom search buttons.",https://www.softpedia.com/get/Internet/Browsers/JiveQ.shtml
Web Browser,JiveQ,WebShot,https://www.softpedia.com/get/Internet/Browsers/JiveQ.shtml
Web Browser,JiveQ,"Instantly get a snapshot of an entire web page. Then print it, copy it, email it or save it.",https://www.softpedia.com/get/Internet/Browsers/JiveQ.shtml
Web Browser,JiveQ,Custom Search Buttons,https://www.softpedia.com/get/Internet/Browsers/JiveQ.shtml
Web Browser,JiveQ,Custom Search buttons can be made for any Search Engine on any web page.,https://www.softpedia.com/get/Internet/Browsers/JiveQ.shtml
Web Browser,JiveQ,Search in Tabs,https://www.softpedia.com/get/Internet/Browsers/JiveQ.shtml
Web Browser,JiveQ,Stay more organized and focused with searches done in separate tabs.,https://www.softpedia.com/get/Internet/Browsers/JiveQ.shtml
Web Browser,JiveQ,SurfButtons,https://www.softpedia.com/get/Internet/Browsers/JiveQ.shtml
Web Browser,JiveQ,SurfButtons bring the information from any search engine one click away. With SurfButtons you don't need to be on a web site to use it's search engine.,https://www.softpedia.com/get/Internet/Browsers/JiveQ.shtml
Web Browser,JiveQ,"SurfButtons are custom, drag and drop buttons used to navigate to a web page or are linked to a search field on any web page.",https://www.softpedia.com/get/Internet/Browsers/JiveQ.shtml
Web Browser,JiveQ,JiveQ's SurfButtons's work with every search engine not just a predefined list.,https://www.softpedia.com/get/Internet/Browsers/JiveQ.shtml
Web Browser,JiveQ,Error Message Search,https://www.softpedia.com/get/Internet/Browsers/JiveQ.shtml
Web Browser,JiveQ,From any application search error message right from the window they are displayed in by pressing Ctrl + Right Click and selecting. Results are shown in new tab.,https://www.softpedia.com/get/Internet/Browsers/JiveQ.shtml
Web Browser,JiveQ,HotKey Search,https://www.softpedia.com/get/Internet/Browsers/JiveQ.shtml
Web Browser,JiveQ,Search the selected word from any application by pressing Ctrl + Alt + S.,https://www.softpedia.com/get/Internet/Browsers/JiveQ.shtml
Web Browser,JiveQ,All HTML,https://www.softpedia.com/get/Internet/Browsers/JiveQ.shtml
Web Browser,JiveQ,For usability consistency all of JiveQ's browser controls are HTML controls.,https://www.softpedia.com/get/Internet/Browsers/JiveQ.shtml
Web Browser,Proxy-Enabled-Browser,"New attractive look, more user friendly.",https://www.softpedia.com/get/Internet/Browsers/Proxy-Enabled-Browser.shtml
Web Browser,Proxy-Enabled-Browser,Add and Manage Bookmarks.,https://www.softpedia.com/get/Internet/Browsers/Proxy-Enabled-Browser.shtml
Web Browser,Proxy-Enabled-Browser,Find and Load Proxy List.,https://www.softpedia.com/get/Internet/Browsers/Proxy-Enabled-Browser.shtml
Web Browser,Proxy-Enabled-Browser,Change proxy using one single click.,https://www.softpedia.com/get/Internet/Browsers/Proxy-Enabled-Browser.shtml
Web Browser,Proxy-Enabled-Browser,Enable and Disable proxy using single click.,https://www.softpedia.com/get/Internet/Browsers/Proxy-Enabled-Browser.shtml
Web Browser,Proxy-Enabled-Browser,Remove complicated Registration and Login Process.,https://www.softpedia.com/get/Internet/Browsers/Proxy-Enabled-Browser.shtml
Web Browser,Proxy-Enabled-Browser,Browse anywhere and anytime.,https://www.softpedia.com/get/Internet/Browsers/Proxy-Enabled-Browser.shtml
Web Browser,Midori,Full integration with GTK+ 2,https://www.softpedia.com/get/Internet/Browsers/Midori.shtml
Web Browser,Midori,Fast rendering with WebKit,https://www.softpedia.com/get/Internet/Browsers/Midori.shtml
Web Browser,Midori,"Tabs, windows and session management",https://www.softpedia.com/get/Internet/Browsers/Midori.shtml
Web Browser,Midori,Flexibly configurable Web Search.,https://www.softpedia.com/get/Internet/Browsers/Midori.shtml
Web Browser,Midori,User scripts and user styles support.,https://www.softpedia.com/get/Internet/Browsers/Midori.shtml
Web Browser,Midori,Straightforward bookmark management.,https://www.softpedia.com/get/Internet/Browsers/Midori.shtml
Web Browser,Midori,Customizable and extensible interface.,https://www.softpedia.com/get/Internet/Browsers/Midori.shtml
Web Browser,Midori,"Extensions such as Adblock, form history, mouse gestures or cookie management.",https://www.softpedia.com/get/Internet/Browsers/Midori.shtml
Web Browser,Avant-Browser-Ultimate,Based on three rendering engines,https://www.softpedia.com/get/Internet/Browsers/Avant-Browser-Ultimate.shtml
Web Browser,Avant-Browser-Ultimate,Multi-Processing,https://www.softpedia.com/get/Internet/Browsers/Avant-Browser-Ultimate.shtml
Web Browser,Avant-Browser-Ultimate,Online Bookmarks,https://www.softpedia.com/get/Internet/Browsers/Avant-Browser-Ultimate.shtml
Web Browser,Avant-Browser-Ultimate,AutoFills,https://www.softpedia.com/get/Internet/Browsers/Avant-Browser-Ultimate.shtml
Web Browser,Avant-Browser-Ultimate,Flash Animation Filter,https://www.softpedia.com/get/Internet/Browsers/Avant-Browser-Ultimate.shtml
Web Browser,Avant-Browser-Ultimate,Mouse Gestures,https://www.softpedia.com/get/Internet/Browsers/Avant-Browser-Ultimate.shtml
Web Browser,Avant-Browser-Ultimate,Private Browsing,https://www.softpedia.com/get/Internet/Browsers/Avant-Browser-Ultimate.shtml
Web Browser,Avant-Browser-Ultimate,Online Profile Storage,https://www.softpedia.com/get/Internet/Browsers/Avant-Browser-Ultimate.shtml
Web Browser,Avant-Browser-Ultimate,Built-in AD/Pop-up Blocker,https://www.softpedia.com/get/Internet/Browsers/Avant-Browser-Ultimate.shtml
Web Browser,Avant-Browser-Ultimate,Built-in RSS/ATOM Reader,https://www.softpedia.com/get/Internet/Browsers/Avant-Browser-Ultimate.shtml
Web Browser,Avant-Browser-Ultimate,Built-in Search Engine,https://www.softpedia.com/get/Internet/Browsers/Avant-Browser-Ultimate.shtml
Web Browser,Avant-Browser-Ultimate,Safe Recovery,https://www.softpedia.com/get/Internet/Browsers/Avant-Browser-Ultimate.shtml
Web Browser,Avant-Browser-Ultimate,Customizable Skins,https://www.softpedia.com/get/Internet/Browsers/Avant-Browser-Ultimate.shtml
Web Browser,Internet-Explorer-Administration-Kit,Distribution options. You can specify how you want to distribute Internet Explorer - either using a product CD or the local area network (LAN). You can also create a configuration-only package to update Internet Explorer settings without installing code on your customers' or users' computers.,https://www.softpedia.com/get/Internet/Browsers/Internet-Explorer-Administration-Kit.shtml
Web Browser,Internet-Explorer-Administration-Kit,Custom components. You can include in-house applications and other programs in the custom package to distribute to your users and computers.,https://www.softpedia.com/get/Internet/Browsers/Internet-Explorer-Administration-Kit.shtml
Web Browser,Internet-Explorer-Administration-Kit,"Setup experience. Depending on your license type, you can set the level of user interaction during the installation and specify settings for the Microsoft Windows Malicious Software Removal Tool, the default browser, and Internet Explorer updates.",https://www.softpedia.com/get/Internet/Browsers/Internet-Explorer-Administration-Kit.shtml
Web Browser,Internet-Explorer-Administration-Kit,Search experience. You can customize the list of search providers for your users.,https://www.softpedia.com/get/Internet/Browsers/Internet-Explorer-Administration-Kit.shtml
Web Browser,Internet-Explorer-Administration-Kit,"Browser experience. You can customize where your users are directed for support; the display of home pages and a welcome page; the list populating Favorites, Links, and Web Feeds; and toolbar buttons.",https://www.softpedia.com/get/Internet/Browsers/Internet-Explorer-Administration-Kit.shtml
Web Browser,Internet-Explorer-Administration-Kit,"Administrator-approved ActiveX controls. You can specify the controls to run while locking out all others, which reduces overhead and troubleshooting issues. The approved set of Microsoft ActiveX controls can be enabled and administered dynamically by using the options in Additional Settings in IEAK Profile Manager.",https://www.softpedia.com/get/Internet/Browsers/Internet-Explorer-Administration-Kit.shtml
Web Browser,Internet-Explorer-Administration-Kit,"Automatic Configuration. You can automatically refresh your users' Internet Explorer settings at regular intervals, or every time the browser is started.",https://www.softpedia.com/get/Internet/Browsers/Internet-Explorer-Administration-Kit.shtml
Web Browser,Maxthon-3,Online Favorites Service: Access your Favorites content anywhere with Maxthon Online Favorites Service. The encrypted stand-alone Favorites file format can protect your privacy on a shared computer.,https://www.softpedia.com/get/Internet/Browsers/Maxthon-3.shtml
Web Browser,Maxthon-3,Tabbed Browsing: All the web pages are arranged as tabs inside main window to ease your navigation.,https://www.softpedia.com/get/Internet/Browsers/Maxthon-3.shtml
Web Browser,Maxthon-3,"Mouse GesturesHold right mouse button and perform the gestures to access common features such as Back, Forward, Refresh and Close Tab.",https://www.softpedia.com/get/Internet/Browsers/Maxthon-3.shtml
Web Browser,Maxthon-3,Super Drag&Drop: Type the keywords in Address Bar then press Enter to perform a search. Or simply drag & drop a keyword with your mouse.,https://www.softpedia.com/get/Internet/Browsers/Maxthon-3.shtml
Web Browser,Maxthon-3,Ad Hunter: Ad Hunter can efficiently clean up the web pages by stopping Popup Windows and removing Ad Content Blocks.,https://www.softpedia.com/get/Internet/Browsers/Maxthon-3.shtml
Web Browser,Maxthon-3,Fully Customizable: Plugins. Skins. Filter Packs. Multi-language,https://www.softpedia.com/get/Internet/Browsers/Maxthon-3.shtml
Web Browser,Refresher,"Refresher PRO has a built-in pop-up manager, where you can block unwanted windows and allow friendly windows.",https://www.softpedia.com/get/Internet/Browsers/Refresher.shtml
Web Browser,Refresher,"Refresher PRO displays all of your favorites which are stored in Internet Explorer, with the ability to manage each of your favorite links.",https://www.softpedia.com/get/Internet/Browsers/Refresher.shtml
Web Browser,Refresher,"The Refresher PRO Quick Search box, for when you just want a quick search (with spell checker).",https://www.softpedia.com/get/Internet/Browsers/Refresher.shtml
Web Browser,Refresher,"Ability to ""Hide"" your second web browser window and resume where you left off at any time.",https://www.softpedia.com/get/Internet/Browsers/Refresher.shtml
Web Browser,Refresher,Intelli-Search where the words you search most often are remembered and predicted for you as you being typing in the Search box.,https://www.softpedia.com/get/Internet/Browsers/Refresher.shtml
Web Browser,Refresher,Preserve Windows Taskbar space by minimising Refresher PRO to the System Tray,https://www.softpedia.com/get/Internet/Browsers/Refresher.shtml
Web Browser,Refresher,Automatically stops Refresher PRO if you navigate within a page which is currently refreshing.,https://www.softpedia.com/get/Internet/Browsers/Refresher.shtml
Web Browser,Refresher,"Quick, convenient 'Rapid Fire' buttons to take you to your web mail and eBay.",https://www.softpedia.com/get/Internet/Browsers/Refresher.shtml
Web Browser,Refresher,"Choose the startup window state, whether you would like it Normal, Maximised or Minimised.",https://www.softpedia.com/get/Internet/Browsers/Refresher.shtml
Web Browser,Refresher,Ability to auto start when Windows starts.,https://www.softpedia.com/get/Internet/Browsers/Refresher.shtml
Web Browser,Refresher,Block web image content to quicken page rendering,https://www.softpedia.com/get/Internet/Browsers/Refresher.shtml
Web Browser,Refresher,Refresh individual windows or both windows at the same time.,https://www.softpedia.com/get/Internet/Browsers/Refresher.shtml
Web Browser,Refresher,Dual browser or single browser mode.,https://www.softpedia.com/get/Internet/Browsers/Refresher.shtml
Web Browser,Refresher,Copy & Go - Quickly and conveniently go to the same address in one browser as in the opposite browser.,https://www.softpedia.com/get/Internet/Browsers/Refresher.shtml
Web Browser,SlimBoat,Completes web form for you automatically and gives you one-click access to your favorite online accounts.,https://www.softpedia.com/get/Internet/Browsers/SlimBoat.shtml
Web Browser,SlimBoat,"You can share a page, a picture or a piece of text on any page on Facebook with a single click.",https://www.softpedia.com/get/Internet/Browsers/SlimBoat.shtml
Web Browser,SlimBoat,The download manager makes it easy to track and organize your download jobs.,https://www.softpedia.com/get/Internet/Browsers/SlimBoat.shtml
Web Browser,SlimBoat,The popup blocker kills all annoying popup ads before it has chance to disturb you.,https://www.softpedia.com/get/Internet/Browsers/SlimBoat.shtml
Web Browser,SlimBoat,The quick-search bar gives you instant access to popular search enginesne while also allow you to create/define your own favorite engine.,https://www.softpedia.com/get/Internet/Browsers/SlimBoat.shtml
Web Browser,SlimBoat,Display current weather condition in the status bar of the web browser so that you know what is going on outside all the time.,https://www.softpedia.com/get/Internet/Browsers/SlimBoat.shtml
Web Browser,SlimBoat,The select-and-translate feature allows you to translate any text within a web page without leaving the page.,https://www.softpedia.com/get/Internet/Browsers/SlimBoat.shtml
Web Browser,SlimBoat,You can type pre-defined short alias instead of long URL to browse frequently visited internet sites.,https://www.softpedia.com/get/Internet/Browsers/SlimBoat.shtml
Web Browser,SlimBoat,The site group feature lets you save a collection of web sites as a group and open all of them at once with a single click.,https://www.softpedia.com/get/Internet/Browsers/SlimBoat.shtml
Web Browser,Gogo-Explorer,Minimum memory usage.,https://www.softpedia.com/get/Internet/Browsers/Gogo-Explorer.shtml
Web Browser,Gogo-Explorer,"Cache manager: smaller flow of the network, faster speed.",https://www.softpedia.com/get/Internet/Browsers/Gogo-Explorer.shtml
Web Browser,Gogo-Explorer,Block all popup AD on more than 1000 test websites.,https://www.softpedia.com/get/Internet/Browsers/Gogo-Explorer.shtml
Web Browser,Gogo-Explorer,"Abundant favorites operate, a real one stand up favorites management of you",https://www.softpedia.com/get/Internet/Browsers/Gogo-Explorer.shtml
