domain,app,requirement,url
Web Browser,Inquiry-Basic-Edition,"Inquiry stores various Web files: entire web pages, selected text and images, Shockwave Flash clips and many others. It can also import documents from your MSIE Favorites and export them to various formats to share with friends and colleagues. Forget cumbersome open and close dialog boxes. Managing your stored pages is quick and easy.",https://www.softpedia.com/get/Internet/Browsers/Inquiry-Basic-Edition.shtml
Web Browser,Inquiry-Basic-Edition,"You access Inquiry simply by clicking a button on the MS Internet Explorer toolbar or Inquiry Sidebar. A single click saves the page you are currently browsing, or your selected text or images. You can choose to display or hide the Inquiry Sidebar by selecting the Internet Explorer Toolbars menu entry from the View menu and then selecting Inquiry Bar.",https://www.softpedia.com/get/Internet/Browsers/Inquiry-Basic-Edition.shtml
Web Browser,Inquiry-Basic-Edition,Besides that you can drag-and-drop a selection of a Web page to either save the selection or to store all pages linked to the selection.,https://www.softpedia.com/get/Internet/Browsers/Inquiry-Basic-Edition.shtml
Web Browser,Inquiry-Basic-Edition,Inquiry stores pages much faster than the regular Internet Explorer Save As feature.,https://www.softpedia.com/get/Internet/Browsers/Inquiry-Basic-Edition.shtml
Web Browser,Inquiry-Basic-Edition,"Inquiry allows you to quickly search in all collected pages and displays the search results in a separate tree folder, allowing you to view them later. It is also easy to organize your stored items as you wish, divide them by theme and purpose, sort in the order you need using drag & drop or using standard ordering methods.",https://www.softpedia.com/get/Internet/Browsers/Inquiry-Basic-Edition.shtml
Web Browser,Inquiry-Basic-Edition,"Information stored in Inquiry never expires or disappears. Even if the Web site stops responding or the contents change, you will be able to browse the pages just as they were stored originally.",https://www.softpedia.com/get/Internet/Browsers/Inquiry-Basic-Edition.shtml
Web Browser,Inquiry-Basic-Edition,Click the Features link to read more on what Inquiry can do for you.,https://www.softpedia.com/get/Internet/Browsers/Inquiry-Basic-Edition.shtml
Web Browser,Inquiry-Basic-Edition,"Using Inquiry you can email stored pages with a couple of clicks. It is easy to convert a page into a convenient format, such as HTML Help file or MHT Archive (to reduce the file size,) Microsoft Word or to a small executable file that includes a compact IE-based browsing application.",https://www.softpedia.com/get/Internet/Browsers/Inquiry-Basic-Edition.shtml
Web Browser,Inquiry-Basic-Edition,"Inquiry is sophisticated enough to meet the needs of professional researchers, yet simple enough for novice users. Researchers, lawyers, writers, scholars, professors, students or just the casual shopper will all find Inquiry just the tool they need to collect, store and manage any type of Internet information.",https://www.softpedia.com/get/Internet/Browsers/Inquiry-Basic-Edition.shtml
Web Browser,Inquiry-Basic-Edition,Inquiry eliminates the concern that information on the Internet today will be gone tomorrow  it puts control of the Internet files in your hands.,https://www.softpedia.com/get/Internet/Browsers/Inquiry-Basic-Edition.shtml
Web Browser,Inquiry-Basic-Edition,"Do you study remotely and need to have all necessary information on your local computer? Inquiry will help you gather Internet pages and articles for your assignments and work with them offline. Using Inquiry, you can save all citation and reference information, and design your own reference styles to be stored with each document.",https://www.softpedia.com/get/Internet/Browsers/Inquiry-Basic-Edition.shtml
Web Browser,Inquiry-Basic-Edition,Inquiry can help compare products and prepare reports and presentations.,https://www.softpedia.com/get/Internet/Browsers/Inquiry-Basic-Edition.shtml
Web Browser,Inquiry-Basic-Edition,Are you searching for the best price of a product on the Internet? Catalog and store all the pages you have found and review them later at your leisure.,https://www.softpedia.com/get/Internet/Browsers/Inquiry-Basic-Edition.shtml
Web Browser,Inquiry-Basic-Edition,Inquiry makes it easy to save and organize Web site information on competitive products and services.,https://www.softpedia.com/get/Internet/Browsers/Inquiry-Basic-Edition.shtml
Web Browser,Inquiry-Basic-Edition,"Using Inquiry, you can organize and store information from government sites as well as research sites such as Westlaw and Lexis.",https://www.softpedia.com/get/Internet/Browsers/Inquiry-Basic-Edition.shtml
Web Browser,Inquiry-Basic-Edition,"Are you studying for a test or doing research for one of your classes? Inquiry provides a fast and easy way to find, save and analyze the information you need--when you need it.",https://www.softpedia.com/get/Internet/Browsers/Inquiry-Basic-Edition.shtml
Web Browser,Inquiry-Basic-Edition,"If you need a fast and easy way to browse, save and analyze the information on the Internet then MetaProducts Inquiry is for you.",https://www.softpedia.com/get/Internet/Browsers/Inquiry-Basic-Edition.shtml
Web Browser,Double-Vision,Web video viewer!,https://www.softpedia.com/get/Multimedia/Video/Video-Players/Double-Vision.shtml
Web Browser,Double-Vision,Click through video!,https://www.softpedia.com/get/Multimedia/Video/Video-Players/Double-Vision.shtml
Web Browser,Double-Vision,Transparent web!,https://www.softpedia.com/get/Multimedia/Video/Video-Players/Double-Vision.shtml
Web Browser,Double-Vision,Quick Hide!,https://www.softpedia.com/get/Multimedia/Video/Video-Players/Double-Vision.shtml
Web Browser,Double-Vision,Auto Mute on Quick Hide!,https://www.softpedia.com/get/Multimedia/Video/Video-Players/Double-Vision.shtml
Web Browser,Double-Vision,Double Vision Mode!,https://www.softpedia.com/get/Multimedia/Video/Video-Players/Double-Vision.shtml
Web Browser,Double-Vision,Custom transparency levels!,https://www.softpedia.com/get/Multimedia/Video/Video-Players/Double-Vision.shtml
Web Browser,Double-Vision,Watch and perform tutorials,https://www.softpedia.com/get/Multimedia/Video/Video-Players/Double-Vision.shtml
Web Browser,Double-Vision,Be stealth at work in Double Vision mode,https://www.softpedia.com/get/Multimedia/Video/Video-Players/Double-Vision.shtml
Web Browser,Double-Vision,Increased productivity as you regain screen real-estate,https://www.softpedia.com/get/Multimedia/Video/Video-Players/Double-Vision.shtml
Web Browser,Double-Vision,Improved ability to multi-task,https://www.softpedia.com/get/Multimedia/Video/Video-Players/Double-Vision.shtml
Web Browser,Chrome-Hybrid,Bypass blocked websites,https://www.softpedia.com/get/Internet/Browsers/Chrome-Hybrid.shtml
Web Browser,Chrome-Hybrid,Multiprofile browsers,https://www.softpedia.com/get/Internet/Browsers/Chrome-Hybrid.shtml
Web Browser,Chrome-Hybrid,Can be launched independently,https://www.softpedia.com/get/Internet/Browsers/Chrome-Hybrid.shtml
Web Browser,Chrome-Hybrid,Retain all functions of the original browser,https://www.softpedia.com/get/Internet/Browsers/Chrome-Hybrid.shtml
Web Browser,Chrome-Hybrid,Portable and can be launched from any carrier,https://www.softpedia.com/get/Internet/Browsers/Chrome-Hybrid.shtml
Web Browser,Chrome-Hybrid,Leave no traces after browsing,https://www.softpedia.com/get/Internet/Browsers/Chrome-Hybrid.shtml
Web Browser,Chrome-Hybrid,Anonymous and safe browsing,https://www.softpedia.com/get/Internet/Browsers/Chrome-Hybrid.shtml
Web Browser,Chrome-Hybrid,Simplified interface,https://www.softpedia.com/get/Internet/Browsers/Chrome-Hybrid.shtml
Web Browser,RFC-Browser-Free-Edition,Powerful parser that analyzes most RFCs.,https://www.softpedia.com/get/Internet/Browsers/RFC-Browser-Free-Edition.shtml
Web Browser,RFC-Browser-Free-Edition,"Rich and friendly user interface: 2 views (Structure View and Page View for RFCs), hyperlink, color rendering, scalable RFC length, print and print preview.",https://www.softpedia.com/get/Internet/Browsers/RFC-Browser-Free-Edition.shtml
Web Browser,RFC-Browser-Free-Edition,Structure View provides a navigating tree of RFC including references.,https://www.softpedia.com/get/Internet/Browsers/RFC-Browser-Free-Edition.shtml
Web Browser,RFC-Browser-Free-Edition,Page View can help you browse the RFC page by page or turn to the page you want anytime.,https://www.softpedia.com/get/Internet/Browsers/RFC-Browser-Free-Edition.shtml
Web Browser,RFC-Browser-Free-Edition,Hypertext-like browsing.,https://www.softpedia.com/get/Internet/Browsers/RFC-Browser-Free-Edition.shtml
Web Browser,RFC-Browser-Free-Edition,Scalable: hide Footers/Headers/blank lines.,https://www.softpedia.com/get/Internet/Browsers/RFC-Browser-Free-Edition.shtml
Web Browser,SmartFinder,Fast and easy internet searching with multi-selected searching engines and searching modes.,https://www.softpedia.com/get/Internet/Browsers/SmartFinder.shtml
Web Browser,SmartFinder,Hot key(Ctrl+C+3) to open an internet searching(Web/Images/Video/News/Map) for highlighted text at any time. (Ctrl+C+4/5/6/7),https://www.softpedia.com/get/Internet/Browsers/SmartFinder.shtml
Web Browser,SmartFinder,"Smooth scrolling, low CPU usage and customized news ticker and stock quote ticker. Click to prompt a news window or stock chart window for quick browsing.",https://www.softpedia.com/get/Internet/Browsers/SmartFinder.shtml
Web Browser,SmartFinder,"Docking tickers on top or on bottom of your desktop, Keep an eye on stock market and all news that concerns you most while working or entertaining yourself on computer.",https://www.softpedia.com/get/Internet/Browsers/SmartFinder.shtml
Web Browser,SmartFinder,Drag and drop to open multiple web browser windows with low computer resource cost.,https://www.softpedia.com/get/Internet/Browsers/SmartFinder.shtml
Web Browser,Brightworks-Web-Browser,User Friendly Interface,https://www.softpedia.com/get/Internet/Browsers/Brightworks-Web-Browser.shtml
Web Browser,Brightworks-Web-Browser,Web Booster,https://www.softpedia.com/get/Internet/Browsers/Brightworks-Web-Browser.shtml
Web Browser,Brightworks-Web-Browser,Bookmarks,https://www.softpedia.com/get/Internet/Browsers/Brightworks-Web-Browser.shtml
Web Browser,Brightworks-Web-Browser,"Instead of tabs, new windows",https://www.softpedia.com/get/Internet/Browsers/Brightworks-Web-Browser.shtml
Web Browser,Brightworks-Web-Browser,Google Search bar,https://www.softpedia.com/get/Internet/Browsers/Brightworks-Web-Browser.shtml
Web Browser,Brightworks-Web-Browser,Light-Weight,https://www.softpedia.com/get/Internet/Browsers/Brightworks-Web-Browser.shtml
Web Browser,Brightworks-Web-Browser,Fast,https://www.softpedia.com/get/Internet/Browsers/Brightworks-Web-Browser.shtml
Web Browser,Blisk,Fully emulated phones and tablets inside,https://www.softpedia.com/get/Internet/Browsers/Blisk.shtml
Web Browser,Blisk,URL and scroll of desktop and mobile are in sync,https://www.softpedia.com/get/Internet/Browsers/Blisk.shtml
Web Browser,Blisk,Blisk refreshes pages automatically on file change,https://www.softpedia.com/get/Internet/Browsers/Blisk.shtml
Web Browser,Blisk,Debug desktop and mobile with DevTools,https://www.softpedia.com/get/Internet/Browsers/Blisk.shtml
Web Browser,Blisk,"Blisk works with any IDE, language and framework",https://www.softpedia.com/get/Internet/Browsers/Blisk.shtml
Web Browser,Circle,Tabbed browsing,https://www.softpedia.com/get/Internet/Browsers/Circle.shtml
Web Browser,Circle,Ez bookmarks,https://www.softpedia.com/get/Internet/Browsers/Circle.shtml
Web Browser,Circle,Smart download manager,https://www.softpedia.com/get/Internet/Browsers/Circle.shtml
Web Browser,Circle,Link manager,https://www.softpedia.com/get/Internet/Browsers/Circle.shtml
Web Browser,Circle,Safe browsing,https://www.softpedia.com/get/Internet/Browsers/Circle.shtml
Web Browser,Circle,Instant search,https://www.softpedia.com/get/Internet/Browsers/Circle.shtml
Web Browser,Optimal-Desktop-Professional-Edition,Optimal Desktop offers 3 levels of Tabbed organization to organize access to your favorite web pages and desktop files and folders in one place.,https://www.softpedia.com/get/Internet/Browsers/Optimal-Desktop-Professional-Edition.shtml
Web Browser,Optimal-Desktop-Professional-Edition,Optimal Desktop integrates access to files and folders with file filtering and preview window built into the system.,https://www.softpedia.com/get/Internet/Browsers/Optimal-Desktop-Professional-Edition.shtml
Web Browser,Optimal-Desktop-Professional-Edition,Subscribing to RSS feeds is a simple drag and drop.  Each feed can be viewed in its own window with flexible update functions.,https://www.softpedia.com/get/Internet/Browsers/Optimal-Desktop-Professional-Edition.shtml
Web Browser,Optimal-Desktop-Professional-Edition,Optimal Desktop offers a highly customizable interface to the online moreover feed generator.  Users can define their filters and information sources and recieve highly customizable information feeds to their desktops.,https://www.softpedia.com/get/Internet/Browsers/Optimal-Desktop-Professional-Edition.shtml
Web Browser,Optimal-Desktop-Professional-Edition,Optimal Desktop offers and integrated popup blocker.,https://www.softpedia.com/get/Internet/Browsers/Optimal-Desktop-Professional-Edition.shtml
Web Browser,Optimal-Desktop-Professional-Edition,Optimal Desktop offers a macro function for recording and playing back a sequence of Internet actions.  This feature is optimal for storing and replaying passwords.,https://www.softpedia.com/get/Internet/Browsers/Optimal-Desktop-Professional-Edition.shtml
Web Browser,Optimal-Desktop-Professional-Edition,"Optimal Desktop let's you isolate your desktop, internet favorites, history and any folder within the folder tree (Section folders) and toggle between these folders in your folder view.",https://www.softpedia.com/get/Internet/Browsers/Optimal-Desktop-Professional-Edition.shtml
Web Browser,Optimal-Desktop-Professional-Edition,Optimal Desktop lets you search your favorites and the content of your RSS feeds in a highly customizable search function.,https://www.softpedia.com/get/Internet/Browsers/Optimal-Desktop-Professional-Edition.shtml
Web Browser,Conqueror-Browser,"Light-weight,",https://www.softpedia.com/get/Internet/Browsers/Conqueror-Browser.shtml
Web Browser,Conqueror-Browser,"Clean interface,",https://www.softpedia.com/get/Internet/Browsers/Conqueror-Browser.shtml
Web Browser,Conqueror-Browser,Tab browsing.,https://www.softpedia.com/get/Internet/Browsers/Conqueror-Browser.shtml
Web Browser,Conqueror-Browser,Uses Microsoft IE's Trident engine by default and Chakra by a patch provided in the package.,https://www.softpedia.com/get/Internet/Browsers/Conqueror-Browser.shtml
Web Browser,Ultimate-Browser,Image Viewer,https://www.softpedia.com/get/Internet/Browsers/Ultimate-Browser.shtml
Web Browser,Ultimate-Browser,Comprehensive HTML editor,https://www.softpedia.com/get/Internet/Browsers/Ultimate-Browser.shtml
Web Browser,Ultimate-Browser,Website Blocker,https://www.softpedia.com/get/Internet/Browsers/Ultimate-Browser.shtml
Web Browser,Ultimate-Browser,Easy browsing without complicated configuration options,https://www.softpedia.com/get/Internet/Browsers/Ultimate-Browser.shtml
Web Browser,Ultimate-Browser,Multi-tabbed interface,https://www.softpedia.com/get/Internet/Browsers/Ultimate-Browser.shtml
Web Browser,Ultimate-Browser,History,https://www.softpedia.com/get/Internet/Browsers/Ultimate-Browser.shtml
Web Browser,Ultimate-Browser,Bookmarking,https://www.softpedia.com/get/Internet/Browsers/Ultimate-Browser.shtml
Web Browser,Ultimate-Browser,Multiple search engine support (9),https://www.softpedia.com/get/Internet/Browsers/Ultimate-Browser.shtml
Web Browser,Ultimate-Browser,No special requirements,https://www.softpedia.com/get/Internet/Browsers/Ultimate-Browser.shtml
Web Browser,Ultimate-Browser,Most errors are suppressed,https://www.softpedia.com/get/Internet/Browsers/Ultimate-Browser.shtml
Web Browser,Ultimate-Browser,Password protection tool,https://www.softpedia.com/get/Internet/Browsers/Ultimate-Browser.shtml
Web Browser,Ultimate-Browser,File downloader,https://www.softpedia.com/get/Internet/Browsers/Ultimate-Browser.shtml
Web Browser,BOLT-Web-Browser,Single-tab browsing,https://www.softpedia.com/get/Internet/Browsers/BOLT-Web-Browser.shtml
Web Browser,BOLT-Web-Browser,"YouTube, Bing and Google search buttons",https://www.softpedia.com/get/Internet/Browsers/BOLT-Web-Browser.shtml
Web Browser,BOLT-Web-Browser,Customizable homepage,https://www.softpedia.com/get/Internet/Browsers/BOLT-Web-Browser.shtml
Web Browser,BOLT-Web-Browser,Easy and fast browsing experience,https://www.softpedia.com/get/Internet/Browsers/BOLT-Web-Browser.shtml
Web Browser,BOLT-Web-Browser,Easy to use installer,https://www.softpedia.com/get/Internet/Browsers/BOLT-Web-Browser.shtml
Web Browser,Maxthon-3,Online Favorites Service: Access your Favorites content anywhere with Maxthon Online Favorites Service. The encrypted stand-alone Favorites file format can protect your privacy on a shared computer.,https://www.softpedia.com/get/Internet/Browsers/Maxthon-3.shtml
Web Browser,Maxthon-3,Tabbed Browsing: All the web pages are arranged as tabs inside main window to ease your navigation.,https://www.softpedia.com/get/Internet/Browsers/Maxthon-3.shtml
Web Browser,Maxthon-3,"Mouse GesturesHold right mouse button and perform the gestures to access common features such as Back, Forward, Refresh and Close Tab.",https://www.softpedia.com/get/Internet/Browsers/Maxthon-3.shtml
Web Browser,Maxthon-3,Super Drag&Drop: Type the keywords in Address Bar then press Enter to perform a search. Or simply drag & drop a keyword with your mouse.,https://www.softpedia.com/get/Internet/Browsers/Maxthon-3.shtml
Web Browser,Maxthon-3,Ad Hunter: Ad Hunter can efficiently clean up the web pages by stopping Popup Windows and removing Ad Content Blocks.,https://www.softpedia.com/get/Internet/Browsers/Maxthon-3.shtml
Web Browser,Maxthon-3,Fully Customizable: Plugins. Skins. Filter Packs. Multi-language,https://www.softpedia.com/get/Internet/Browsers/Maxthon-3.shtml
Web Browser,Lively-TopGoGoGo,Tabbed Mode and Tree Mode Browsing;,https://www.softpedia.com/get/Internet/Browsers/Lively-TopGoGoGo.shtml
Web Browser,Lively-TopGoGoGo,Top Sites List and Site Directory Explorer;,https://www.softpedia.com/get/Internet/Browsers/Lively-TopGoGoGo.shtml
Web Browser,Lively-TopGoGoGo,Top Forums List and Forum Directory Explorer;,https://www.softpedia.com/get/Internet/Browsers/Lively-TopGoGoGo.shtml
Web Browser,Lively-TopGoGoGo,Top Software List and Software Directory Explorer;,https://www.softpedia.com/get/Internet/Browsers/Lively-TopGoGoGo.shtml
Web Browser,Lively-TopGoGoGo,Bookmark Your Favorites;,https://www.softpedia.com/get/Internet/Browsers/Lively-TopGoGoGo.shtml
Web Browser,Lively-TopGoGoGo,Automatic Online Weekly Updates.,https://www.softpedia.com/get/Internet/Browsers/Lively-TopGoGoGo.shtml
Web Browser,Aqua-Web-Browser,Cross-platformed Ribbon UI,https://www.softpedia.com/get/Internet/Browsers/Aqua-Web-Browser.shtml
Web Browser,Aqua-Web-Browser,Tabbed browsing,https://www.softpedia.com/get/Internet/Browsers/Aqua-Web-Browser.shtml
Web Browser,Aqua-Web-Browser,Whole web page save as image file,https://www.softpedia.com/get/Internet/Browsers/Aqua-Web-Browser.shtml
Web Browser,Aqua-Web-Browser,"Click thumbnail image, then found it on page",https://www.softpedia.com/get/Internet/Browsers/Aqua-Web-Browser.shtml
Web Browser,Aqua-Web-Browser,Anti shoulder surfing,https://www.softpedia.com/get/Internet/Browsers/Aqua-Web-Browser.shtml
Web Browser,Muddly,"Fully adjustable split screen browsing environment. Muddly supports 4 panes, Top, Bottom, Right and Left. These panes can be further divided for precise control of composite documents. All panes support tabs and all panes can be maximized.",https://www.softpedia.com/get/Internet/Browsers/Muddly.shtml
Web Browser,Muddly,Muddly documents allow you to compile a web archive using your Windows file system. This allows you to collect many documents containing all the sites of interest for that document without cluttering your Favorites collection. Whatever you have on screen under a document tab can be saved in the Muddly .mud file format. You can open and restore your content and layout anytime later. As files they can be sent as file attachments in E-mail etc.,https://www.softpedia.com/get/Internet/Browsers/Muddly.shtml
Web Browser,Muddly,"You can open one or more RSS feeds in the Muddly Tree Browser - this allows you to view any page in a feed without opening more than one browser pane - giving you more control of your favorite feeds. If required you can open any item in a new tab, window or document. Feeds are integral with the document - when you save a document that contains a feed - it will open along with the other document content when you return to it.",https://www.softpedia.com/get/Internet/Browsers/Muddly.shtml
Web Browser,Muddly,"The Muddly Tree Browser works the same way with your Favorites too - this is the fastest, most convenient way to look through your Favorites and find the page you are looking for with just one view. It's the same story for your History too.",https://www.softpedia.com/get/Internet/Browsers/Muddly.shtml
Web Browser,Muddly,Muddly isn't trying to replace the rich functionality and special features of Internet Explorer - we dont ask you to make it your default browser or change anything at all. Muddly has a unique feature set and its own place in your software inventory.,https://www.softpedia.com/get/Internet/Browsers/Muddly.shtml
Web Browser,Muddly,Muddly turns the web into a well organised reference - and there'll be certain documents you'll want to refer to all of the time. When you don't need it on the desktop you can reduce it to the system tray ready when you need it.,https://www.softpedia.com/get/Internet/Browsers/Muddly.shtml
Web Browser,Muddly,Muddly looks great with a skin to suit your taste - browsing feels better too when you decide on the ambience.,https://www.softpedia.com/get/Internet/Browsers/Muddly.shtml
Web Browser,My-Kids-Browser,Protects your children every second they're on the internet!,https://www.softpedia.com/get/Internet/Browsers/My-Kids-Browser.shtml
Web Browser,My-Kids-Browser,Web-page analyzer that analyzes any page you add to their list.,https://www.softpedia.com/get/Internet/Browsers/My-Kids-Browser.shtml
Web Browser,My-Kids-Browser,"Desktop lockdown that allows you to prohibit children from using Internet Explorer, Firefox, etc so that they only use the KidSafe Internet Browser. (For Windows 2000 & XP)",https://www.softpedia.com/get/Internet/Browsers/My-Kids-Browser.shtml
Web Browser,My-Kids-Browser,History area that lets you see where your kids have been (they will only have access to SAFE areas),https://www.softpedia.com/get/Internet/Browsers/My-Kids-Browser.shtml
Web Browser,My-Kids-Browser,"Helps children learn and practice math, English, and science",https://www.softpedia.com/get/Internet/Browsers/My-Kids-Browser.shtml
Web Browser,My-Kids-Browser,Sandbox area for kids to play almost unlimited games.,https://www.softpedia.com/get/Internet/Browsers/My-Kids-Browser.shtml
Web Browser,My-Kids-Browser,Put time restrictions on the internet by using the Mr. Pocketwatch Feature,https://www.softpedia.com/get/Internet/Browsers/My-Kids-Browser.shtml
Web Browser,My-Kids-Browser,Full featured web browser,https://www.softpedia.com/get/Internet/Browsers/My-Kids-Browser.shtml
Web Browser,My-Kids-Browser,Password-protected Parental Admin,https://www.softpedia.com/get/Internet/Browsers/My-Kids-Browser.shtml
Web Browser,My-Kids-Browser,Unlimited updates / auto-update checker,https://www.softpedia.com/get/Internet/Browsers/My-Kids-Browser.shtml
Web Browser,My-Kids-Browser,Keeps children safer than by using only filtered internet,https://www.softpedia.com/get/Internet/Browsers/My-Kids-Browser.shtml
Web Browser,My-Kids-Browser,Pop-up blocker (configurable),https://www.softpedia.com/get/Internet/Browsers/My-Kids-Browser.shtml
Web Browser,My-Kids-Browser,Enable / Disable the printer and search bar,https://www.softpedia.com/get/Internet/Browsers/My-Kids-Browser.shtml
Web Browser,My-Kids-Browser,View how long your children have used the internet per day.,https://www.softpedia.com/get/Internet/Browsers/My-Kids-Browser.shtml
Web Browser,BriskBard,BriskBard uses its own rendering engine to view the HTML content in the feeds. The possible threats that take advantage of bugs in other rendering engines have no effect in BriskBard.,https://www.softpedia.com/get/Internet/Browsers/BriskBard.shtml
Web Browser,BriskBard,BriskBard has an easy to use subscription manager with the possibility to search newsgroups by a part of their name.,https://www.softpedia.com/get/Internet/Browsers/BriskBard.shtml
Web Browser,BriskBard,"You can access the contact manager from several places to add, select or edit the information in each contact. If the contact has a photo, it will be shown in the article viewer when you select an article from that contact.",https://www.softpedia.com/get/Internet/Browsers/BriskBard.shtml
Web Browser,BriskBard,You can attach a vCard selecting a contact in the contacts manager.,https://www.softpedia.com/get/Internet/Browsers/BriskBard.shtml
Web Browser,BriskBard,"If the contact has a photo, it will be shown in the article viewer when you select an article from that contact.",https://www.softpedia.com/get/Internet/Browsers/BriskBard.shtml
Web Browser,BriskBard,"The article viewer has an attached image viewer with rotate, zoom and print functions.",https://www.softpedia.com/get/Internet/Browsers/BriskBard.shtml
Web Browser,BriskBard,External resources can be downloaded automatically or manually in the article viewer.,https://www.softpedia.com/get/Internet/Browsers/BriskBard.shtml
