domain,app,requirement,url
Web Browser,Maxthon-3,Online Favorites Service: Access your Favorites content anywhere with Maxthon Online Favorites Service. The encrypted stand-alone Favorites file format can protect your privacy on a shared computer.,https://www.softpedia.com/get/Internet/Browsers/Maxthon-3.shtml
Web Browser,Maxthon-3,Tabbed Browsing: All the web pages are arranged as tabs inside main window to ease your navigation.,https://www.softpedia.com/get/Internet/Browsers/Maxthon-3.shtml
Web Browser,Maxthon-3,"Mouse GesturesHold right mouse button and perform the gestures to access common features such as Back, Forward, Refresh and Close Tab.",https://www.softpedia.com/get/Internet/Browsers/Maxthon-3.shtml
Web Browser,Maxthon-3,Super Drag&Drop: Type the keywords in Address Bar then press Enter to perform a search. Or simply drag & drop a keyword with your mouse.,https://www.softpedia.com/get/Internet/Browsers/Maxthon-3.shtml
Web Browser,Maxthon-3,Ad Hunter: Ad Hunter can efficiently clean up the web pages by stopping Popup Windows and removing Ad Content Blocks.,https://www.softpedia.com/get/Internet/Browsers/Maxthon-3.shtml
Web Browser,Maxthon-3,Fully Customizable: Plugins. Skins. Filter Packs. Multi-language,https://www.softpedia.com/get/Internet/Browsers/Maxthon-3.shtml
Web Browser,Mozilla-Firefox-Final,Comprehensive popup controls to keep unwanted advertising off your desktop;,https://www.softpedia.com/get/Internet/Browsers/Mozilla-Firefox-Final.shtml
Web Browser,Mozilla-Firefox-Final,"A tab browsing mode that lets you open several pages in a single window, allowing you to load links in the background without leaving the page you're on;",https://www.softpedia.com/get/Internet/Browsers/Mozilla-Firefox-Final.shtml
Web Browser,Mozilla-Firefox-Final,Integrated search (powered by Google);,https://www.softpedia.com/get/Internet/Browsers/Mozilla-Firefox-Final.shtml
Web Browser,Mozilla-Firefox-Final,Industry leading accessibility with Find As You Type - find links and page text by simply typing;,https://www.softpedia.com/get/Internet/Browsers/Mozilla-Firefox-Final.shtml
Web Browser,Mozilla-Firefox-Final,Simplified privacy controls that let you cover your tracks more effectively;,https://www.softpedia.com/get/Internet/Browsers/Mozilla-Firefox-Final.shtml
Web Browser,Mozilla-Firefox-Final,A streamlined browser window that lets you see more of the page than any other browser while at the same time being more configurable;,https://www.softpedia.com/get/Internet/Browsers/Mozilla-Firefox-Final.shtml
Web Browser,Mozilla-Firefox-Final,A large variety of free downloadable extensions and themes that add specific functionality and visual changes to the browser.,https://www.softpedia.com/get/Internet/Browsers/Mozilla-Firefox-Final.shtml
Web Browser,Google-Chrome,Quick to start up from your desktop,https://www.softpedia.com/get/Internet/Browsers/Google-Chrome.shtml
Web Browser,Google-Chrome,Loads web pages in a snap,https://www.softpedia.com/get/Internet/Browsers/Google-Chrome.shtml
Web Browser,Google-Chrome,Runs web applications faster than ever,https://www.softpedia.com/get/Internet/Browsers/Google-Chrome.shtml
Web Browser,Google-Chrome,Search and navigate to web pages from the same box,https://www.softpedia.com/get/Internet/Browsers/Google-Chrome.shtml
Web Browser,Google-Chrome,Arrange and organize tabs however you wish  quickly and easily,https://www.softpedia.com/get/Internet/Browsers/Google-Chrome.shtml
Web Browser,Google-Chrome,"Get to your favorite websites with just a click, from the thumbnails of your most visited sites in the New Tab page",https://www.softpedia.com/get/Internet/Browsers/Google-Chrome.shtml
Web Browser,Google-Chrome,"Try Minimalist, Star Gazing, or Google Chrome Artist Themes.",https://www.softpedia.com/get/Internet/Browsers/Google-Chrome.shtml
Web Browser,Google-Chrome,One box for everything,https://www.softpedia.com/get/Internet/Browsers/Google-Chrome.shtml
Web Browser,Google-Chrome,New Tab page,https://www.softpedia.com/get/Internet/Browsers/Google-Chrome.shtml
Web Browser,Google-Chrome,Application shortcuts,https://www.softpedia.com/get/Internet/Browsers/Google-Chrome.shtml
Web Browser,Google-Chrome,Dynamic tabs,https://www.softpedia.com/get/Internet/Browsers/Google-Chrome.shtml
Web Browser,Google-Chrome,Crash control,https://www.softpedia.com/get/Internet/Browsers/Google-Chrome.shtml
Web Browser,Google-Chrome,Incognito mode,https://www.softpedia.com/get/Internet/Browsers/Google-Chrome.shtml
Web Browser,Google-Chrome,Safe browsing,https://www.softpedia.com/get/Internet/Browsers/Google-Chrome.shtml
Web Browser,Google-Chrome,Instant bookmarks,https://www.softpedia.com/get/Internet/Browsers/Google-Chrome.shtml
Web Browser,Google-Chrome,Importing settings,https://www.softpedia.com/get/Internet/Browsers/Google-Chrome.shtml
Web Browser,Google-Chrome,Simpler downloads,https://www.softpedia.com/get/Internet/Browsers/Google-Chrome.shtml
Web Browser,Opera-for-Windows-without-Java,"Opera keeps your browsing safe, so you can stay focused on the content. Our secure browser protects you from fraud and malware on the web. Would you like better privacy on the web? Try our unlimited, free VPN feature.",https://www.softpedia.com/get/Internet/Browsers/Opera-for-Windows-without-Java.shtml
Web Browser,Opera-for-Windows-without-Java,"Tired of online ads? Opera is the first major browser that can block ads for you without add-ons. According to tests, our built-in ad blocker makes content-rich webpages load in Opera up to 90% faster.",https://www.softpedia.com/get/Internet/Browsers/Opera-for-Windows-without-Java.shtml
Web Browser,Opera-for-Windows-without-Java,"Our visual bookmarks, tab cycling and customizable shortcuts, keep you on track and save you time. Can't get enough online video? Dont miss our new video pop out feature - a floating, moveable video frame that lets you keep browsing or work in other apps without missing any of the action.",https://www.softpedia.com/get/Internet/Browsers/Opera-for-Windows-without-Java.shtml
Web Browser,Opera-for-Windows-without-Java,"Operas speed and performance are among our top priorities. The data-compressing Opera Turbo feature, native ad blocker and other features will help you browse faster. And, the new battery saver feature will help you browse longer, too: it extends laptop battery life by up to 50%.",https://www.softpedia.com/get/Internet/Browsers/Opera-for-Windows-without-Java.shtml
Web Browser,Opera-for-Windows-without-Java,"With a currency converter built right into the browser, Opera helps you shop online around the world without any nasty surprises on your credit card bill.",https://www.softpedia.com/get/Internet/Browsers/Opera-for-Windows-without-Java.shtml
Web Browser,Opera-for-Windows-without-Java,"Over 1,000 extensions make it easy to customize Opera. Download the extensions and themes you like from Operas add-ons catalog to get the best browser experience with a personal touch. With the animated themes, you can even bring Operas start page to life.",https://www.softpedia.com/get/Internet/Browsers/Opera-for-Windows-without-Java.shtml
Web Browser,Opera-for-Windows-without-Java,"Switch between devices and pick up browsing where you left off with Opera sync. Bookmarks, open tabs and other data stay synced through your Opera account. Want to keep Opera with all its settings handy on a USB drive? Try our portable version.",https://www.softpedia.com/get/Internet/Browsers/Opera-for-Windows-without-Java.shtml
Web Browser,Opera-for-Windows-without-Java,"Opera brings the latest news to one spot, available from the browsers start page. Personalize your news feed to read what is most relevant to you. You can add preferred news sources from all over the world, in addition to the top 50 articles from your region.",https://www.softpedia.com/get/Internet/Browsers/Opera-for-Windows-without-Java.shtml
Web Browser,Internet-Explorer-9,The new graphic capabilities and improved performance in Internet Explorer 9 set the stage for immersive and rich experiences.,https://www.softpedia.com/get/Internet/Browsers/Internet-Explorer-9.shtml
Web Browser,Internet-Explorer-9,"Internet Explorer 9 surfaces the websites you love most and puts them one click away. Once you're in the browser, the New Tab page helps get you started browsing quickly, providing meaningful suggestions and information to help you decide what to do next as you browse.",https://www.softpedia.com/get/Internet/Browsers/Internet-Explorer-9.shtml
Web Browser,Internet-Explorer-9,"Notifications in Internet Explorer 9 allow for more fluid and faster browsing. Instead of dialog boxes popping up unexpectedly and getting in your way, all notification messages are consolidated in the Notification Bar, located at the bottom of the browser frame.",https://www.softpedia.com/get/Internet/Browsers/Internet-Explorer-9.shtml
Web Browser,Internet-Explorer-9,"With Pinned Sites, you can get to your favorite sites directly from the Windows taskbarwithout having to open Internet Explorer first.",https://www.softpedia.com/get/Internet/Browsers/Internet-Explorer-9.shtml
Web Browser,Internet-Explorer-9,Tear-off tabs make interacting with multiple sites fast and intuitive. You can rearrange tabs within Internet Explorer 9just like you can rearrange icons in the taskbar in Windows 7or you can open any tab in a new browser window by dragging that tab to your desktop.,https://www.softpedia.com/get/Internet/Browsers/Internet-Explorer-9.shtml
Web Browser,Internet-Explorer-9,"Designed based on what you use most, the navigational controls in Internet Explorer 9 are streamlined and simplified. The back button is larger, the address bar and search box are combined into one new address bar, and the multiple menus from previous versions of Internet Explorer are consolidated into a single menu.",https://www.softpedia.com/get/Internet/Browsers/Internet-Explorer-9.shtml
Web Browser,Internet-Explorer-9,"Cross-site scripting attacks are a leading online threat. Their aim is to exploit vulnerabilities in the websites you visit. How do they work? By compromising legitimate websites with malicious content that can capture keystrokes and record your login information and password. If your login information and password is captured, your personal data could be compromised.",https://www.softpedia.com/get/Internet/Browsers/Internet-Explorer-9.shtml
Web Browser,Internet-Explorer-9,"One way to avoid deceptive websites is to know the address of the website you're intending to visit. With domain highlighting, Internet Explorer 9 lets you see the true web address at a glance by highlighting the domain name in the address bar, making it easier for you to identify the sites you visit.",https://www.softpedia.com/get/Internet/Browsers/Internet-Explorer-9.shtml
Web Browser,Fast-Browser-Pro,"Advanced browsing mode: can open up to 180 web pages at once, support many easy ways to manage your browsing, and can show each homepage's download progress.",https://www.softpedia.com/get/Internet/Browsers/Fast-Browser-Pro.shtml
Web Browser,Fast-Browser-Pro,"Power search: includes more than 500 search engines and 100 search categories, so search any information you want without taking any pain.",https://www.softpedia.com/get/Internet/Browsers/Fast-Browser-Pro.shtml
Web Browser,Fast-Browser-Pro,Voice function: can speak homepage's content in different tones and ACTIONS. listen to your favorite websites now.,https://www.softpedia.com/get/Internet/Browsers/Fast-Browser-Pro.shtml
Web Browser,Fast-Browser-Pro,"Casual surfing: what is Casual Surfing? That is to say, it will kill your dullness and show you an unexpected website each time, a funny way to surf the web.",https://www.softpedia.com/get/Internet/Browsers/Fast-Browser-Pro.shtml
Web Browser,Fast-Browser-Pro,Multi-language Translation: allows you to change the language in which you view the page (includes up to 35 languages).,https://www.softpedia.com/get/Internet/Browsers/Fast-Browser-Pro.shtml
Web Browser,Fast-Browser-Pro,"Website scan: can check all Urls in a homepage and show each url's create date, file size, link state (active or dead) or even the server name.",https://www.softpedia.com/get/Internet/Browsers/Fast-Browser-Pro.shtml
Web Browser,Fast-Browser-Pro,Links filter: select each exact link in a large homepage as quickly as you want.,https://www.softpedia.com/get/Internet/Browsers/Fast-Browser-Pro.shtml
Web Browser,Fast-Browser-Pro,"Quick download: set download options easily, such as picture, sound, movie, or even the SCRIPT.",https://www.softpedia.com/get/Internet/Browsers/Fast-Browser-Pro.shtml
Web Browser,Fast-Browser-Pro,"Cookies management: can show all cookies in your computer; can also filter, change or delete the cookies.",https://www.softpedia.com/get/Internet/Browsers/Fast-Browser-Pro.shtml
Web Browser,Fast-Browser-Pro,Group working: Improve your surfing speed with many homepages opening at the same time.,https://www.softpedia.com/get/Internet/Browsers/Fast-Browser-Pro.shtml
Web Browser,Maxthon-3,Online Favorites Service: Access your Favorites content anywhere with Maxthon Online Favorites Service. The encrypted stand-alone Favorites file format can protect your privacy on a shared computer.,https://www.softpedia.com/get/Internet/Browsers/Maxthon-3.shtml
Web Browser,Maxthon-3,Tabbed Browsing: All the web pages are arranged as tabs inside main window to ease your navigation.,https://www.softpedia.com/get/Internet/Browsers/Maxthon-3.shtml
Web Browser,Maxthon-3,"Mouse GesturesHold right mouse button and perform the gestures to access common features such as Back, Forward, Refresh and Close Tab.",https://www.softpedia.com/get/Internet/Browsers/Maxthon-3.shtml
Web Browser,Maxthon-3,Super Drag&Drop: Type the keywords in Address Bar then press Enter to perform a search. Or simply drag & drop a keyword with your mouse.,https://www.softpedia.com/get/Internet/Browsers/Maxthon-3.shtml
Web Browser,Maxthon-3,Ad Hunter: Ad Hunter can efficiently clean up the web pages by stopping Popup Windows and removing Ad Content Blocks.,https://www.softpedia.com/get/Internet/Browsers/Maxthon-3.shtml
Web Browser,Maxthon-3,Fully Customizable: Plugins. Skins. Filter Packs. Multi-language,https://www.softpedia.com/get/Internet/Browsers/Maxthon-3.shtml
Web Browser,Avant-Browser,Online Profile Storage,https://www.softpedia.com/get/Internet/Browsers/Avant-Browser.shtml
Web Browser,Avant-Browser,AutoFills,https://www.softpedia.com/get/Internet/Browsers/Avant-Browser.shtml
Web Browser,Avant-Browser,Built-in AD/Pop-up Blocker,https://www.softpedia.com/get/Internet/Browsers/Avant-Browser.shtml
Web Browser,Avant-Browser,Built-in RSS/ATOM Reader,https://www.softpedia.com/get/Internet/Browsers/Avant-Browser.shtml
Web Browser,Avant-Browser,Additional Mouse Functions,https://www.softpedia.com/get/Internet/Browsers/Avant-Browser.shtml
Web Browser,Avant-Browser,Multi-Window Browsing,https://www.softpedia.com/get/Internet/Browsers/Avant-Browser.shtml
Web Browser,Avant-Browser,Real Full Screen Mode and Alternative Full Desktop mode,https://www.softpedia.com/get/Internet/Browsers/Avant-Browser.shtml
Web Browser,Avant-Browser,Built-in Search Engine,https://www.softpedia.com/get/Internet/Browsers/Avant-Browser.shtml
Web Browser,Avant-Browser,Full IE Compatibility,https://www.softpedia.com/get/Internet/Browsers/Avant-Browser.shtml
Web Browser,Avant-Browser,Control Your Privacy,https://www.softpedia.com/get/Internet/Browsers/Avant-Browser.shtml
Web Browser,Avant-Browser,Safe Recovery,https://www.softpedia.com/get/Internet/Browsers/Avant-Browser.shtml
Web Browser,Avant-Browser,Customizable Skins,https://www.softpedia.com/get/Internet/Browsers/Avant-Browser.shtml
Web Browser,Internet-Explorer-11,Compatibility enhancements,https://www.softpedia.com/get/Internet/Browsers/Internet-Explorer-11.shtml
Web Browser,Internet-Explorer-11,WebGL and High DPI support,https://www.softpedia.com/get/Internet/Browsers/Internet-Explorer-11.shtml
Web Browser,Internet-Explorer-11,Optimized for touch screens,https://www.softpedia.com/get/Internet/Browsers/Internet-Explorer-11.shtml
Web Browser,Internet-Explorer-11,Powerful developer tools for creating Windows Store apps using JavaScript,https://www.softpedia.com/get/Internet/Browsers/Internet-Explorer-11.shtml
Web Browser,Internet-Explorer-11,"Fast website loading (prerender and prefetch, caching and prioritization)",https://www.softpedia.com/get/Internet/Browsers/Internet-Explorer-11.shtml
Web Browser,Internet-Explorer-11,Enhanced view of websites and Windows Store apps using JavaScript,https://www.softpedia.com/get/Internet/Browsers/Internet-Explorer-11.shtml
Web Browser,Internet-Explorer-11,Tile support and tile notifications with RSS,https://www.softpedia.com/get/Internet/Browsers/Internet-Explorer-11.shtml
Web Browser,Internet-Explorer-11,Personalized look and better integration with the Windows environment,https://www.softpedia.com/get/Internet/Browsers/Internet-Explorer-11.shtml
Web Browser,Orkut-Cute,"You can create several standard messages: they are stored in a database, so that you don't need to type them all over again.",https://www.softpedia.com/get/Internet/Browsers/Orkut-Cute.shtml
Web Browser,Orkut-Cute,You can choose to which friends you want to send your message,https://www.softpedia.com/get/Internet/Browsers/Orkut-Cute.shtml
Web Browser,Orkut-Cute,"Macroreplacement unique system. By placing the identifiers $nc$ or $nl$ anywhere on your message, they will be replaced by your friend's name once the message is posted.",https://www.softpedia.com/get/Internet/Browsers/Orkut-Cute.shtml
Web Browser,Orkut-Cute,"By activating the ""random messages"" option the program will search messages randomly on its database everytime it posts. This way you will be able to create several messages and each of your friends will receive a different message.",https://www.softpedia.com/get/Internet/Browsers/Orkut-Cute.shtml
Web Browser,GreenBrowser,"You can search direct by drag text in browser. The other way, you also can add special search button to search bar, for example: news, software, image, BT, dictionary, MP3, click the search button will begin search, no use to switch search engine in pop menu. The best and speedy way is direct drag drop text on search button.",https://www.softpedia.com/get/Internet/Browsers/GreenBrowser.shtml
Web Browser,GreenBrowser,"There are 15 search buttons in the search bar image: Baidu, Google, Yahoo, GreenBrowser Search, 163 Search, MSN Search, Google Feeling Lucky, Baidu Know, Baidu News, Google Image, BT Search, MP3 Search, Software Search, Shopping Search. If you like powerful search bar, click here to download and uncompress to GreenBrowser's user folder.",https://www.softpedia.com/get/Internet/Browsers/GreenBrowser.shtml
Web Browser,GreenBrowser,"You can add some frequently use programs link in external toolbar by ""Set External Toolbar..."". After That you can set the program ""Auto Start with GreenBrowser"" or ""Auto Close with GreenBrowser"".",https://www.softpedia.com/get/Internet/Browsers/GreenBrowser.shtml
Web Browser,GreenBrowser,Tab bar icon show the state of page: blank page? finish download? read or not? locked? protected? saved?,https://www.softpedia.com/get/Internet/Browsers/GreenBrowser.shtml
Web Browser,Safari,Closed Captions for HTML5 Video,https://www.softpedia.com/get/Internet/Browsers/Safari.shtml
Web Browser,Safari,Custom Style Sheets,https://www.softpedia.com/get/Internet/Browsers/Safari.shtml
Web Browser,Safari,Enhanced Keyboard Navigation,https://www.softpedia.com/get/Internet/Browsers/Safari.shtml
Web Browser,Safari,Next-Generation Standards Support,https://www.softpedia.com/get/Internet/Browsers/Safari.shtml
Web Browser,Safari,HTML5 AJAX History,https://www.softpedia.com/get/Internet/Browsers/Safari.shtml
Web Browser,Safari,Advanced Page Caching,https://www.softpedia.com/get/Internet/Browsers/Safari.shtml
Web Browser,Safari,HTML5 Draggable Attribute,https://www.softpedia.com/get/Internet/Browsers/Safari.shtml
Web Browser,Safari,Full Screen for HTML5 Video,https://www.softpedia.com/get/Internet/Browsers/Safari.shtml
Web Browser,Safari,Location Services Preferences,https://www.softpedia.com/get/Internet/Browsers/Safari.shtml
Web Browser,Safari,HTML5 Offline Support,https://www.softpedia.com/get/Internet/Browsers/Safari.shtml
Web Browser,Pale-Moon,Optimized for modern processors,https://www.softpedia.com/get/Internet/Browsers/Pale-Moon.shtml
Web Browser,Pale-Moon,Based on our own optimized layout engine (Goanna),https://www.softpedia.com/get/Internet/Browsers/Pale-Moon.shtml
Web Browser,Pale-Moon,Safe: forked from mature Mozilla code and regularly updated,https://www.softpedia.com/get/Internet/Browsers/Pale-Moon.shtml
Web Browser,Pale-Moon,Secure: Additional security features and security-aware development,https://www.softpedia.com/get/Internet/Browsers/Pale-Moon.shtml
Web Browser,Pale-Moon,"Supported by a friendly, active community of users",https://www.softpedia.com/get/Internet/Browsers/Pale-Moon.shtml
Web Browser,Pale-Moon,"Familiar, efficient, fully customizable interface",https://www.softpedia.com/get/Internet/Browsers/Pale-Moon.shtml
Web Browser,Pale-Moon,Support for full themes: total freedom over any element's design,https://www.softpedia.com/get/Internet/Browsers/Pale-Moon.shtml
Web Browser,Pale-Moon,Support for easily-created lightweight themes (skins),https://www.softpedia.com/get/Internet/Browsers/Pale-Moon.shtml
Web Browser,Pale-Moon,Smooth and speedy page drawing and script processing,https://www.softpedia.com/get/Internet/Browsers/Pale-Moon.shtml
Web Browser,Pale-Moon,Increased stability: experience fewer browser crashes,https://www.softpedia.com/get/Internet/Browsers/Pale-Moon.shtml
Web Browser,Pale-Moon,Support for many Firefox extensions,https://www.softpedia.com/get/Internet/Browsers/Pale-Moon.shtml
Web Browser,Pale-Moon,Support for a growing number of Pale Moon exclusive extensions,https://www.softpedia.com/get/Internet/Browsers/Pale-Moon.shtml
Web Browser,Pale-Moon,Extensive and growing support for HTML5 and CSS3,https://www.softpedia.com/get/Internet/Browsers/Pale-Moon.shtml
Web Browser,Pale-Moon,Many customization and configuration options,https://www.softpedia.com/get/Internet/Browsers/Pale-Moon.shtml
Web Browser,Flock-for-Windows,Update your status and make comments from anywhere on the web New Flock starts fast,https://www.softpedia.com/get/Internet/Browsers/Flock-for-Windows.shtml
Web Browser,Flock-for-Windows,And it handles JavaScript really fast,https://www.softpedia.com/get/Internet/Browsers/Flock-for-Windows.shtml
Web Browser,Flock-for-Windows,"The JavaScript engine in Chromium allows Flock to keep you up to date with all your friends and favorite feeds, while keeping the browser's performance top notch",https://www.softpedia.com/get/Internet/Browsers/Flock-for-Windows.shtml
Web Browser,Flock-for-Windows,"The sidebar is the hub of activity in Flock. It keeps you informed with feed content and social streams so you don't have to leave the web page you are on. As soon as you sign into your social services and/or subscribe to RSS and ATOM feeds, the sidebar starts delivering what's new with your friends and favorite content",https://www.softpedia.com/get/Internet/Browsers/Flock-for-Windows.shtml
Web Browser,Flock-for-Windows,"The sidebar works like the channels on a TV. Use the ""channel changer"" drop down menu at the top of the sidebar to see just friends on Facebook, just friends on Twitter, all friends, just feeds, etc. But this is better than TV, because you can create any channel you want!",https://www.softpedia.com/get/Internet/Browsers/Flock-for-Windows.shtml
Web Browser,Flock-for-Windows,"Talk about the news, the funny video you just found, or anything else you stumble upon. Just click the Talk button, write a comment, and get back to what you were doing. We'll automatically add the link, and even shorten it for you.",https://www.softpedia.com/get/Internet/Browsers/Flock-for-Windows.shtml
Web Browser,Flock-for-Windows,"We know there are lots of people who want to customize and personalize their online experience, and browser extensions can be a great way to do that. Google Chrome extensions work with Flock.",https://www.softpedia.com/get/Internet/Browsers/Flock-for-Windows.shtml
Web Browser,Flock-for-Windows,"Flock provides you the option of creating a free account that stores your favorite sites and feeds, your social networking accounts, and all the groups you make for your sidebar. You can access your account from any Flock browse.",https://www.softpedia.com/get/Internet/Browsers/Flock-for-Windows.shtml
Web Browser,ChromePlus,"When the browser closed, the selected browsing data would be cleared automatically(not selected by default). You can go to OptionsPrivacy DataPrivacy Plus to setup.",https://www.softpedia.com/get/Internet/Browsers/ChromePlus.shtml
Web Browser,ChromePlus,You can make efficient commands with easy mouse gestures. Practiced mouse gestures can save you quite a lot of time and are fun.,https://www.softpedia.com/get/Internet/Browsers/ChromePlus.shtml
Web Browser,ChromePlus,Some web pages use IE controls and thus can only run in IE correctly. The IE tab is designed to visit these pages.,https://www.softpedia.com/get/Internet/Browsers/ChromePlus.shtml
Web Browser,ChromePlus,"With the bulid-in Adblock, CoolNovo can prevent the display of ads. Especially, the Adblock of CoolNovo supports the rules of the world famous Adblock Plus' rule and thus make use of the existing blocking-list of Adblock Plus.",https://www.softpedia.com/get/Internet/Browsers/ChromePlus.shtml
Web Browser,ChromePlus,Dragging and dropping a block of text in the page will create a page and search the text with your default search engine. You can also drag the links and pictures to open them in the newtab page.,https://www.softpedia.com/get/Internet/Browsers/ChromePlus.shtml
